Player,Tm,ins_20_att,ins_20_yds,ins_20_tds,ins_20_%rush,ins_10_att,ins_10_yds,ins_10_tds,ins_10_%rush,ins_5_att,ins_5_yds,ins_5_tds,ins_5_%rush,link,-9999
Jamaal Williams,DET,57,107,16,60.0%,45,70,15,73.8%,28,24,14,84.8%,All Jamaal Williams red zone rushing plays,WillJa06
Kenneth Walker,SEA,48,151,7,73.8%,16,7,2,76.2%,9,-3,1,100.0%,All Kenneth Walker red zone rushing plays,WalkKe00
Austin Ekeler,LAC,47,165,10,64.4%,24,58,10,63.2%,8,9,6,53.3%,All Austin Ekeler red zone rushing plays,EkelAu00
Miles Sanders,PHI,45,129,10,37.8%,26,63,8,36.1%,11,17,5,26.8%,All Miles Sanders red zone rushing plays,SandMi01
Jalen Hurts,PHI,44,122,11,37.0%,26,47,11,36.1%,20,12,9,48.8%,All Jalen Hurts red zone rushing plays,HurtJa00
Travis Etienne,JAX,40,149,4,50.0%,23,44,4,47.9%,10,5,2,43.5%,All Travis Etienne red zone rushing plays,EtieTr00
Josh Jacobs,LVR,40,110,9,76.9%,23,35,8,85.2%,11,8,5,91.7%,All Josh Jacobs red zone rushing plays,JacoJo01
Dalvin Cook,MIN,39,72,6,60.0%,24,28,6,53.3%,15,12,5,60.0%,All Dalvin Cook red zone rushing plays,CookDa01
Najee Harris,PIT,39,128,7,52.7%,22,51,6,53.7%,9,6,3,37.5%,All Najee Harris red zone rushing plays,HarrNa00
Tyler Allgeier,ATL,38,140,3,34.2%,17,40,3,35.4%,6,4,1,33.3%,All Tyler Allgeier red zone rushing plays,AllgTy00
Christian McCaffrey,2TM,38,100,7,,21,34,5,,10,5,5,,All Christian McCaffrey red zone rushing plays,McCaCh01
Joe Mixon,CIN,38,98,7,49.4%,29,55,6,58.0%,14,10,5,63.6%,All Joe Mixon red zone rushing plays,MixoJo00
Nick Chubb,CLE,37,91,9,46.8%,20,34,7,52.6%,12,12,6,63.2%,All Nick Chubb red zone rushing plays,ChubNi00
Derrick Henry,TEN,36,118,11,75.0%,17,27,10,70.8%,15,24,10,88.2%,All Derrick Henry red zone rushing plays,HenrDe00
Saquon Barkley,NYG,35,100,8,47.3%,23,53,7,51.1%,14,24,7,58.3%,All Saquon Barkley red zone rushing plays,BarkSa00
Ezekiel Elliott,DAL,35,97,12,50.0%,26,53,11,61.9%,16,17,9,69.6%,All Ezekiel Elliott red zone rushing plays,ElliEz00
Devin Singletary,BUF,33,83,4,43.4%,17,35,4,43.6%,7,1,2,38.9%,All Devin Singletary red zone rushing plays,SingDe00
D'Onta Foreman,CAR,32,105,5,43.8%,16,28,3,48.5%,7,8,3,50.0%,All D'Onta Foreman red zone rushing plays,ForeDO00
Dameon Pierce,HOU,32,55,3,54.2%,15,19,3,50.0%,7,-2,3,53.8%,All Dameon Pierce red zone rushing plays,PierDa01
David Montgomery,CHI,31,115,5,36.9%,16,56,5,37.2%,3,3,2,15.0%,All David Montgomery red zone rushing plays,MontDa01
Rhamondre Stevenson,NWE,31,49,3,50.0%,19,21,3,59.4%,7,3,2,58.3%,All Rhamondre Stevenson red zone rushing plays,StevRh00
Jonathan Taylor,IND,31,58,3,43.7%,16,19,3,50.0%,8,8,3,50.0%,All Jonathan Taylor red zone rushing plays,TaylJo02
Isiah Pacheco,KAN,30,86,5,35.7%,20,54,5,43.5%,7,8,3,30.4%,All Isiah Pacheco red zone rushing plays,PachIs00
Cordarrelle Patterson,ATL,30,134,8,27.0%,12,34,6,25.0%,5,11,4,27.8%,All Cordarrelle Patterson red zone rushing plays,PattCo00
Aaron Jones,GNB,29,91,2,44.6%,9,17,0,28.1%,2,2,0,12.5%,All Aaron Jones red zone rushing plays,JoneAa00
Cam Akers,LAR,27,79,7,54.0%,14,30,6,53.8%,8,8,5,57.1%,All Cam Akers red zone rushing plays,AkerCa00
AJ Dillon,GNB,27,72,5,41.5%,17,34,5,53.1%,10,10,4,62.5%,All AJ Dillon red zone rushing plays,DillAJ00
Leonard Fournette,TAM,26,44,3,52.0%,19,25,3,65.5%,8,7,3,61.5%,All Leonard Fournette red zone rushing plays,FourLe00
Josh Allen,BUF,25,77,6,32.9%,15,23,5,38.5%,11,7,4,61.1%,All Josh Allen red zone rushing plays,AlleJo02
Justin Fields,CHI,25,58,5,29.8%,15,26,5,34.9%,10,19,5,50.0%,All Justin Fields red zone rushing plays,FielJu00
Antonio Gibson,WAS,25,48,3,32.1%,16,17,3,37.2%,8,-5,3,47.1%,All Antonio Gibson red zone rushing plays,GibsAn00
Kareem Hunt,CLE,25,59,2,31.6%,12,32,2,31.6%,4,6,2,21.1%,All Kareem Hunt red zone rushing plays,HuntKa00
Daniel Jones,NYG,24,76,6,32.4%,14,28,5,31.1%,7,-4,3,29.2%,All Daniel Jones red zone rushing plays,JoneDa05
Jeff Wilson,2TM,24,59,3,,16,23,3,,8,2,3,,All Jeff Wilson red zone rushing plays,WilsJe01
James Conner,ARI,23,79,6,33.8%,15,52,6,44.1%,6,8,4,37.5%,All James Conner red zone rushing plays,ConnJa00
Tony Pollard,DAL,23,99,6,32.9%,12,23,3,28.6%,6,4,2,26.1%,All Tony Pollard red zone rushing plays,PollTo00
Brian Robinson,WAS,23,51,2,29.5%,14,19,2,32.6%,5,4,2,29.4%,All Brian Robinson red zone rushing plays,RobiBr01
D'Andre Swift,DET,23,111,5,24.2%,11,44,4,18.0%,4,2,2,12.1%,All D'Andre Swift red zone rushing plays,SwifDA00
Joe Burrow,CIN,21,52,5,27.3%,14,21,4,28.0%,7,8,4,31.8%,All Joe Burrow red zone rushing plays,BurrJo01
Khalil Herbert,CHI,20,70,4,23.8%,8,7,2,18.6%,6,2,2,30.0%,All Khalil Herbert red zone rushing plays,HerbKh00
Alvin Kamara,NOR,20,38,2,36.4%,8,9,2,30.8%,4,8,2,36.4%,All Alvin Kamara red zone rushing plays,KamaAl00
Jerick McKinnon,KAN,20,48,0,23.8%,7,5,0,15.2%,5,1,0,21.7%,All Jerick McKinnon red zone rushing plays,McKiJe00
Raheem Mostert,MIA,20,54,2,39.2%,8,13,1,38.1%,3,2,1,25.0%,All Raheem Mostert red zone rushing plays,MostRa00
Michael Carter,NYJ,19,42,3,31.1%,8,21,3,26.7%,3,4,2,21.4%,All Michael Carter red zone rushing plays,CartMi03
Kenyan Drake,BAL,19,41,3,21.6%,7,17,3,17.5%,3,8,3,18.8%,All Kenyan Drake red zone rushing plays,DrakKe00
Caleb Huntley,ATL,19,89,1,17.1%,8,29,1,16.7%,1,2,0,5.6%,All Caleb Huntley red zone rushing plays,HuntCa02
Lamar Jackson,BAL,19,77,2,21.6%,9,17,2,22.5%,4,3,1,25.0%,All Lamar Jackson red zone rushing plays,JackLa00
Taysom Hill,NOR,17,67,6,30.9%,12,45,5,46.2%,3,2,2,27.3%,All Taysom Hill red zone rushing plays,HillTa00
Marcus Mariota,ATL,17,41,4,15.3%,8,16,4,16.7%,4,4,3,22.2%,All Marcus Mariota red zone rushing plays,MariMa01
James Robinson,2TM,17,30,1,,10,2,0,,4,1,0,,All James Robinson red zone rushing plays,RobiJa00
Kenneth Gainwell,PHI,16,68,4,13.4%,12,41,4,16.7%,6,13,3,14.6%,All Kenneth Gainwell red zone rushing plays,GainKe00
Zack Moss,IND,16,41,1,22.5%,7,1,0,21.9%,3,-3,0,18.8%,All Zack Moss red zone rushing plays,MossZa00
Breece Hall,NYJ,15,49,2,24.6%,9,13,2,30.0%,4,-2,1,28.6%,All Breece Hall red zone rushing plays,HallBr03
Chuba Hubbard,CAR,15,54,2,20.5%,5,12,1,15.2%,1,2,1,7.1%,All Chuba Hubbard red zone rushing plays,HubbCh01
Samaje Perine,CIN,15,35,2,19.5%,6,15,2,12.0%,0,0,0,.0%,All Samaje Perine red zone rushing plays,PeriSa00
J.K. Dobbins,BAL,14,36,2,15.9%,7,17,2,17.5%,4,8,2,25.0%,All J.K. Dobbins red zone rushing plays,DobbJK00
Melvin Gordon,DEN,14,18,2,36.8%,10,8,2,35.7%,6,2,2,40.0%,All Melvin Gordon red zone rushing plays,GordMe00
Joshua Kelley,LAC,14,28,2,19.2%,8,15,2,21.1%,3,4,1,20.0%,All Joshua Kelley red zone rushing plays,KellJo01
Trevor Lawrence,JAX,14,26,5,17.5%,9,19,5,18.8%,6,7,5,26.1%,All Trevor Lawrence red zone rushing plays,LawrTr00
Patrick Mahomes,KAN,14,94,4,16.7%,6,20,3,13.0%,3,6,2,13.0%,All Patrick Mahomes red zone rushing plays,MahoPa00
Eno Benjamin,2TM,13,50,2,,5,9,1,,1,2,0,,All Eno Benjamin red zone rushing plays,BenjEn00
Alexander Mattison,MIN,13,46,5,20.0%,12,32,4,26.7%,3,-3,2,12.0%,All Alexander Mattison red zone rushing plays,MattAl01
Gus Edwards,BAL,12,17,3,13.6%,7,17,3,17.5%,2,2,2,12.5%,All Gus Edwards red zone rushing plays,EdwaGu00
Elijah Mitchell,SFO,12,50,2,11.8%,7,21,2,11.7%,2,0,0,6.5%,All Elijah Mitchell red zone rushing plays,MitcEl00
Kyler Murray,ARI,12,28,3,17.6%,5,10,3,14.7%,4,5,2,25.0%,All Kyler Murray red zone rushing plays,MurrKy00
Latavius Murray,2TM,12,37,6,,11,30,6,,6,10,5,,All Latavius Murray red zone rushing plays,MurrLa00
Jaylen Warren,PIT,12,40,1,16.2%,4,10,1,9.8%,2,3,1,8.3%,All Jaylen Warren red zone rushing plays,WarrJa01
James Cook,BUF,11,29,0,14.5%,4,11,0,10.3%,0,0,0,.0%,All James Cook red zone rushing plays,CookJa01
Damien Harris,NWE,11,39,3,17.7%,6,19,3,18.8%,2,4,2,16.7%,All Damien Harris red zone rushing plays,HarrDa06
Tyler Huntley,BAL,11,29,1,12.5%,4,13,1,10.0%,1,2,1,6.3%,All Tyler Huntley red zone rushing plays,HuntTy01
Kenny Pickett,PIT,11,30,3,14.9%,7,8,3,17.1%,6,5,3,25.0%,All Kenny Pickett red zone rushing plays,PickKe00
Rachaad White,TAM,11,25,1,22.0%,5,4,1,17.2%,3,2,1,23.1%,All Rachaad White red zone rushing plays,WhitRa01
Jacoby Brissett,CLE,10,22,2,12.7%,5,7,2,13.2%,2,7,2,10.5%,All Jacoby Brissett red zone rushing plays,BrisJa00
Tyrion Davis-Price,SFO,10,8,0,9.8%,4,-1,0,6.7%,1,-1,0,3.2%,All Tyrion Davis-Price red zone rushing plays,DaviTy03
Zonovan Knight,NYJ,10,30,1,16.4%,4,1,0,13.3%,3,1,0,21.4%,All Zonovan Knight red zone rushing plays,KnigZo00
Boston Scott,PHI,10,34,3,8.4%,5,16,3,6.9%,3,3,2,7.3%,All Boston Scott red zone rushing plays,ScotBo02
Tom Brady,TAM,9,3,1,18.0%,2,2,1,6.9%,2,2,1,15.4%,All Tom Brady red zone rushing plays,BradTo00
Matt Breida,NYG,9,32,1,12.2%,4,8,1,8.9%,1,3,1,4.2%,All Matt Breida red zone rushing plays,BreiMa00
Clyde Edwards-Helaire,KAN,9,22,3,10.7%,5,4,2,10.9%,4,4,2,17.4%,All Clyde Edwards-Helaire red zone rushing plays,EdwaCl00
Darrell Henderson,LAR,9,30,3,18.0%,7,25,3,26.9%,3,8,2,21.4%,All Darrell Henderson red zone rushing plays,HendDa00
Deon Jackson,IND,9,29,1,12.7%,1,3,1,3.1%,1,3,1,6.3%,All Deon Jackson red zone rushing plays,JackDe02
Keaontay Ingram,ARI,8,11,1,11.8%,2,-2,1,5.9%,2,-2,1,12.5%,All Keaontay Ingram red zone rushing plays,IngrKe01
Mac Jones,NWE,8,4,1,12.9%,3,10,1,9.4%,1,3,1,8.3%,All Mac Jones red zone rushing plays,JoneMa05
Dare Ogunbowale,HOU,8,27,1,13.6%,4,15,1,13.3%,2,5,1,15.4%,All Dare Ogunbowale red zone rushing plays,OgunDa00
Deebo Samuel,SFO,8,29,2,7.8%,3,11,1,5.0%,1,-2,0,3.2%,All Deebo Samuel red zone rushing plays,SamuDe00
Zach Wilson,NYJ,8,18,1,13.1%,4,11,1,13.3%,2,0,0,14.3%,All Zach Wilson red zone rushing plays,WilsZa00
Royce Freeman,HOU,7,11,0,11.9%,3,6,0,10.0%,0,0,0,.0%,All Royce Freeman red zone rushing plays,FreeRo00
Jaret Patterson,WAS,7,22,0,9.0%,3,6,0,7.0%,0,0,0,.0%,All Jaret Patterson red zone rushing plays,PattJa01
Brock Purdy,SFO,7,6,1,6.9%,6,0,1,10.0%,5,-2,1,16.1%,All Brock Purdy red zone rushing plays,PurdBr00
Aaron Rodgers,GNB,7,14,1,10.8%,5,-4,1,15.6%,4,-1,1,25.0%,All Aaron Rodgers red zone rushing plays,RodgAa00
Curtis Samuel,WAS,7,26,1,9.0%,1,10,1,2.3%,0,0,0,.0%,All Curtis Samuel red zone rushing plays,SamuCu00
Geno Smith,SEA,7,35,1,10.8%,2,8,1,9.5%,0,0,0,.0%,All Geno Smith red zone rushing plays,SmitGe00
Ryan Tannehill,TEN,7,10,2,14.6%,6,2,2,25.0%,2,2,2,11.8%,All Ryan Tannehill red zone rushing plays,TannRy00
Kirk Cousins,MIN,6,26,2,9.2%,4,-6,1,8.9%,3,-2,1,12.0%,All Kirk Cousins red zone rushing plays,CousKi00
Andy Dalton,NOR,6,7,0,10.9%,2,5,0,7.7%,2,5,0,18.2%,All Andy Dalton red zone rushing plays,DaltAn00
Trestan Ebner,CHI,6,16,0,7.1%,4,7,0,9.3%,1,1,0,5.0%,All Trestan Ebner red zone rushing plays,EbneTr00
Jamycal Hasty,JAX,6,10,1,7.5%,4,7,1,8.3%,2,-2,0,8.7%,All Jamycal Hasty red zone rushing plays,HastJa02
Justin Herbert,LAC,6,23,0,8.2%,3,5,0,7.9%,1,2,0,6.7%,All Justin Herbert red zone rushing plays,HerbJu00
Baker Mayfield,CAR,6,24,1,8.2%,1,7,1,3.0%,0,0,0,.0%,All Baker Mayfield red zone rushing plays,MayfBa00
Davis Mills,HOU,6,34,2,10.2%,3,10,1,10.0%,1,4,1,7.7%,All Davis Mills red zone rushing plays,MillDa02
Dak Prescott,DAL,6,31,1,8.6%,2,11,1,4.8%,0,0,0,.0%,All Dak Prescott red zone rushing plays,PresDa01
Deshaun Watson,CLE,6,16,1,7.6%,1,1,0,2.6%,1,1,0,5.3%,All Deshaun Watson red zone rushing plays,WatsDe00
Raheem Blackshear,CAR,5,19,3,6.8%,4,17,3,12.1%,2,2,1,14.3%,All Raheem Blackshear red zone rushing plays,BlacRa00
Sam Darnold,CAR,5,19,2,6.8%,4,6,2,12.1%,3,7,2,21.4%,All Sam Darnold red zone rushing plays,DarnSa00
Chase Edmonds,MIA,5,4,2,9.8%,2,4,2,9.5%,2,4,2,16.7%,All Chase Edmonds red zone rushing plays,EdmoCh00
Jimmy Garoppolo,SFO,5,6,2,4.9%,4,3,2,6.7%,4,3,2,12.9%,All Jimmy Garoppolo red zone rushing plays,GaroJi00
Nyheim Hines,2TM,5,3,1,,5,3,1,,1,-2,0,,All Nyheim Hines red zone rushing plays,HineNy00
Mark Ingram,NOR,5,15,1,9.1%,3,7,1,11.5%,1,0,0,9.1%,All Mark Ingram red zone rushing plays,IngrMa01
Justin Jackson,DET,5,27,1,5.3%,2,5,0,3.3%,1,1,0,3.0%,All Justin Jackson red zone rushing plays,JackJu01
Kyle Juszczyk,SFO,5,22,1,4.9%,2,1,1,3.3%,2,1,1,6.5%,All Kyle Juszczyk red zone rushing plays,JuszKy00
Sony Michel,LAC,5,8,0,6.8%,2,0,0,5.3%,2,0,0,13.3%,All Sony Michel red zone rushing plays,MichSo00
Rashaad Penny,SEA,5,5,0,7.7%,1,1,0,4.8%,0,0,0,.0%,All Rashaad Penny red zone rushing plays,PennRa00
Desmond Ridder,ATL,5,8,0,4.5%,2,0,0,4.2%,2,0,0,11.1%,All Desmond Ridder red zone rushing plays,RiddDe00
Carson Wentz,WAS,5,23,1,6.4%,4,10,1,9.3%,2,3,1,11.8%,All Carson Wentz red zone rushing plays,WentCa00
Jonathan Williams,WAS,5,5,0,6.4%,1,-3,0,2.3%,1,-3,0,5.9%,All Jonathan Williams red zone rushing plays,WillJo07
Russell Wilson,DEN,5,36,3,13.2%,2,7,2,7.1%,2,7,2,13.3%,All Russell Wilson red zone rushing plays,WilsRu00
Gary Brightwell,NYG,4,5,1,5.4%,3,2,1,6.7%,1,2,1,4.2%,All Gary Brightwell red zone rushing plays,BrigGa00
Malcolm Brown,LAR,4,1,0,8.0%,3,-2,0,11.5%,2,0,0,14.3%,All Malcolm Brown red zone rushing plays,BrowMa03
Tevin Coleman,SFO,4,3,1,3.9%,2,3,1,3.3%,1,-2,0,3.2%,All Tevin Coleman red zone rushing plays,ColeTe01
Sam Ehlinger,IND,4,9,0,5.6%,2,4,0,6.3%,1,0,0,6.3%,All Sam Ehlinger red zone rushing plays,EhliSa00
Jared Goff,DET,4,-1,0,4.2%,2,-1,0,3.3%,0,0,0,.0%,All Jared Goff red zone rushing plays,GoffJa00
Taylor Heinicke,WAS,4,12,1,5.1%,3,8,1,7.0%,1,1,1,5.9%,All Taylor Heinicke red zone rushing plays,HeinTa00
Justice Hill,BAL,4,15,0,4.5%,1,3,0,2.5%,0,0,0,.0%,All Justice Hill red zone rushing plays,HillJu00
Trey Lance,SFO,4,19,0,3.9%,1,3,0,1.7%,0,0,0,.0%,All Trey Lance red zone rushing plays,LancTr00
Matt Ryan,IND,4,3,1,5.6%,3,2,1,9.4%,2,1,1,12.5%,All Matt Ryan red zone rushing plays,RyanMa00
Amon-Ra St. Brown,DET,4,12,0,4.2%,1,4,0,1.6%,0,0,0,.0%,All Amon-Ra St. Brown red zone rushing plays,StxxAm00
Tua Tagovailoa,MIA,4,8,0,7.8%,0,0,0,.0%,0,0,0,.0%,All Tua Tagovailoa red zone rushing plays,TagoTu00
Darrel Williams,ARI,4,8,1,5.9%,1,1,1,2.9%,1,1,1,6.3%,All Darrel Williams red zone rushing plays,WillDa10
Javonte Williams,DEN,4,8,0,10.5%,4,8,0,14.3%,1,0,0,6.7%,All Javonte Williams red zone rushing plays,WillJa10
Tutu Atwell,LAR,3,12,1,6.0%,0,0,0,.0%,0,0,0,.0%,All Tutu Atwell red zone rushing plays,AtweTu00
Brandon Bolden,LVR,3,7,0,5.8%,2,4,0,7.4%,1,3,0,8.3%,All Brandon Bolden red zone rushing plays,BoldBr00
Rex Burkhead,HOU,3,0,0,5.1%,3,0,0,10.0%,2,-3,0,15.4%,All Rex Burkhead red zone rushing plays,BurkRe00
Derek Carr,LVR,3,7,0,5.8%,0,0,0,.0%,0,0,0,.0%,All Derek Carr red zone rushing plays,CarrDe02
Corey Clement,ARI,3,9,1,4.4%,3,9,1,8.8%,1,1,1,6.3%,All Corey Clement red zone rushing plays,ClemCo00
Malik Davis,DAL,3,16,0,4.3%,1,1,0,2.4%,0,0,0,.0%,All Malik Davis red zone rushing plays,DaviMa02
Mike Davis,BAL,3,4,0,3.4%,2,1,0,5.0%,2,1,0,12.5%,All Mike Davis red zone rushing plays,DaviMi01
Jeff Driskel,HOU,3,-1,0,5.1%,2,0,0,6.7%,1,1,0,7.7%,All Jeff Driskel red zone rushing plays,DrisJe00
Devin Duvernay,BAL,3,24,1,3.4%,1,2,0,2.5%,0,0,0,.0%,All Devin Duvernay red zone rushing plays,DuveDe00
Kevin Harris,NWE,3,18,1,4.8%,1,3,0,3.1%,0,0,0,.0%,All Kevin Harris red zone rushing plays,HarrKe01
Travis Homer,SEA,3,4,0,4.6%,2,3,0,9.5%,0,0,0,.0%,All Travis Homer red zone rushing plays,HomeTr00
Jordan Mason,SFO,3,17,1,2.9%,2,3,0,3.3%,1,-1,0,3.2%,All Jordan Mason red zone rushing plays,MasoJo00
Nick Mullens,MIN,3,6,0,4.6%,2,2,0,4.4%,1,0,0,4.0%,All Nick Mullens red zone rushing plays,MullNi00
Pierre Strong,NWE,3,5,1,4.8%,1,3,1,3.1%,1,3,1,8.3%,All Pierre Strong red zone rushing plays,StroPi00
Mitchell Trubisky,PIT,3,2,2,4.1%,3,2,2,7.3%,3,2,2,12.5%,All Mitchell Trubisky red zone rushing plays,TrubMi00
Mike White,NYJ,3,7,1,4.9%,3,7,1,10.0%,1,1,1,7.1%,All Mike White red zone rushing plays,WhitMi01
Malik Willis,TEN,3,25,1,6.3%,1,4,0,4.2%,0,0,0,.0%,All Malik Willis red zone rushing plays,WillMa12
Salvon Ahmed,MIA,2,16,1,3.9%,0,0,0,.0%,0,0,0,.0%,All Salvon Ahmed red zone rushing plays,AhmeSa01
Giovani Bernard,TAM,2,5,0,4.0%,1,4,0,3.4%,0,0,0,.0%,All Giovani Bernard red zone rushing plays,BernGi00
Kendrick Bourne,NWE,2,-8,0,3.2%,0,0,0,.0%,0,0,0,.0%,All Kendrick Bourne red zone rushing plays,BourKe00
Spencer Brown,CAR,2,5,0,2.7%,2,5,0,6.1%,0,0,0,.0%,All Spencer Brown red zone rushing plays,BrowSp01
Julius Chestnut,TEN,2,-3,0,4.2%,0,0,0,.0%,0,0,0,.0%,All Julius Chestnut red zone rushing plays,ChesJu00
DeeJay Dallas,SEA,2,4,0,3.1%,0,0,0,.0%,0,0,0,.0%,All DeeJay Dallas red zone rushing plays,DallDe00
Greg Dortch,ARI,2,12,0,2.9%,1,3,0,2.9%,1,3,0,6.3%,All Greg Dortch red zone rushing plays,DortGr01
Chris Godwin,TAM,2,3,0,4.0%,2,3,0,6.9%,0,0,0,.0%,All Chris Godwin red zone rushing plays,GodwCh00
C.J. Ham,MIN,2,4,2,3.1%,2,4,2,4.4%,2,4,2,8.0%,All C.J. Ham red zone rushing plays,HamxC.00
Chad Henne,KAN,2,-2,0,2.4%,2,-2,0,4.3%,0,0,0,.0%,All Chad Henne red zone rushing plays,HennCh01
Tyreek Hill,MIA,2,1,1,3.9%,1,2,1,4.8%,1,2,1,8.3%,All Tyreek Hill red zone rushing plays,HillTy00
Alec Ingold,MIA,2,1,1,3.9%,2,1,1,9.5%,2,1,1,16.7%,All Alec Ingold red zone rushing plays,IngoAl01
David Johnson,NOR,2,4,0,3.6%,0,0,0,.0%,0,0,0,.0%,All David Johnson red zone rushing plays,JohnDa08
Diontae Johnson,PIT,2,5,0,2.7%,0,0,0,.0%,0,0,0,.0%,All Diontae Johnson red zone rushing plays,JohnDi01
Ty Johnson,NYJ,2,0,0,3.3%,0,0,0,.0%,0,0,0,.0%,All Ty Johnson red zone rushing plays,JohnTy02
Zay Jones,JAX,2,7,0,2.5%,1,0,0,2.1%,0,0,0,.0%,All Zay Jones red zone rushing plays,JoneZa00
Case Keenum,BUF,2,-2,0,2.6%,0,0,0,.0%,0,0,0,.0%,All Case Keenum red zone rushing plays,KeenCa00
Travis Kelce,KAN,2,5,0,2.4%,2,5,0,4.3%,1,1,0,4.3%,All Travis Kelce red zone rushing plays,KelcTr00
Colt McCoy,ARI,2,5,0,2.9%,1,2,0,2.9%,0,0,0,.0%,All Colt McCoy red zone rushing plays,McCoCo00
Isaiah McKenzie,BUF,2,2,1,2.6%,1,7,1,2.6%,0,0,0,.0%,All Isaiah McKenzie red zone rushing plays,McKeIs00
Gardner Minshew,PHI,2,4,1,1.7%,2,4,1,2.8%,1,1,1,2.4%,All Gardner Minshew red zone rushing plays,MinsGa00
Bryce Perkins,LAR,2,0,0,4.0%,1,-4,0,3.8%,0,0,0,.0%,All Bryce Perkins red zone rushing plays,PerkBr02
Brandon Powell,LAR,2,9,0,4.0%,0,0,0,.0%,0,0,0,.0%,All Brandon Powell red zone rushing plays,PoweBr00
Adam Prentice,NOR,2,4,0,3.6%,0,0,0,.0%,0,0,0,.0%,All Adam Prentice red zone rushing plays,PrenAd00
Patrick Ricard,BAL,2,3,0,2.3%,2,3,0,5.0%,0,0,0,.0%,All Patrick Ricard red zone rushing plays,RicaPa00
Durham Smythe,MIA,2,1,1,3.9%,1,1,1,4.8%,1,1,1,8.3%,All Durham Smythe red zone rushing plays,SmytDu00
Benny Snell,PIT,2,4,1,2.7%,1,2,1,2.4%,1,2,1,4.2%,All Benny Snell red zone rushing plays,SnelBe00
Jarrett Stidham,LVR,2,13,0,3.8%,1,4,0,3.7%,0,0,0,.0%,All Jarrett Stidham red zone rushing plays,StidJa00
Trent Taylor,CIN,2,6,0,2.6%,1,-3,0,2.0%,1,-3,0,4.5%,All Trent Taylor red zone rushing plays,TaylTr02
Tyquan Thornton,NWE,2,18,1,3.2%,1,-1,0,3.1%,0,0,0,.0%,All Tyquan Thornton red zone rushing plays,ThorTy00
Kadarius Toney,KAN,2,25,1,2.4%,0,0,0,.0%,0,0,0,.0%,All Kadarius Toney red zone rushing plays,ToneKa00
Derek Watt,PIT,2,3,1,2.7%,1,1,1,2.4%,1,1,1,4.2%,All Derek Watt red zone rushing plays,WattDe00
Zamir White,LVR,2,-5,0,3.8%,0,0,0,.0%,0,0,0,.0%,All Zamir White red zone rushing plays,WhitZa01
Jordan Wilkins,IND,2,5,0,2.8%,0,0,0,.0%,0,0,0,.0%,All Jordan Wilkins red zone rushing plays,WilkJo01
Avery Williams,ATL,2,6,1,1.8%,1,8,1,2.1%,0,0,0,.0%,All Avery Williams red zone rushing plays,WillAv02
Ameer Abdullah,LVR,1,3,0,1.9%,1,3,0,3.7%,0,0,0,.0%,All Ameer Abdullah red zone rushing plays,AbduAm00
Daniel Bellinger,NYG,1,2,1,1.4%,1,2,1,2.2%,1,2,1,4.2%,All Daniel Bellinger red zone rushing plays,BellDa00
Braxton Berrios,NYJ,1,15,1,1.6%,0,0,0,.0%,0,0,0,.0%,All Braxton Berrios red zone rushing plays,BerrBr00
Mike Boone,DEN,1,1,0,2.6%,0,0,0,.0%,0,0,0,.0%,All Mike Boone red zone rushing plays,BoonMi00
Teddy Bridgewater,MIA,1,10,0,2.0%,0,0,0,.0%,0,0,0,.0%,All Teddy Bridgewater red zone rushing plays,BridTe00
Michael Burton,KAN,1,2,0,1.2%,0,0,0,.0%,0,0,0,.0%,All Michael Burton red zone rushing plays,BurtMi00
Parris Campbell,IND,1,1,0,1.4%,0,0,0,.0%,0,0,0,.0%,All Parris Campbell red zone rushing plays,CampPa00
Ja'Marr Chase,CIN,1,-1,0,1.3%,0,0,0,.0%,0,0,0,.0%,All Ja'Marr Chase red zone rushing plays,ChasJa00
Chase Claypool,PIT,1,0,0,1.4%,1,0,0,2.4%,1,0,0,4.2%,All Chase Claypool red zone rushing plays,ClayCh01
Tyler Conklin,NYJ,1,1,0,1.6%,1,1,0,3.3%,1,1,0,7.1%,All Tyler Conklin red zone rushing plays,ConkTy00
Snoop Conner,JAX,1,3,1,1.3%,1,3,1,2.1%,1,3,1,4.3%,All Snoop Conner red zone rushing plays,ConnSn00
Evan Engram,JAX,1,0,0,1.3%,1,0,0,2.1%,0,0,0,.0%,All Evan Engram red zone rushing plays,EngrEv00
Nick Foles,IND,1,0,0,1.4%,0,0,0,.0%,0,0,0,.0%,All Nick Foles red zone rushing plays,FoleNi00
Noah Gray,KAN,1,1,1,1.2%,1,1,1,2.2%,1,1,1,4.3%,All Noah Gray red zone rushing plays,GrayNo00
KJ Hamler,DEN,1,9,0,2.6%,0,0,0,.0%,0,0,0,.0%,All KJ Hamler red zone rushing plays,HamlKJ00
Mecole Hardman,KAN,1,3,1,1.2%,1,3,1,2.2%,1,3,1,4.3%,All Mecole Hardman red zone rushing plays,HardMe00
Peyton Hendershot,DAL,1,2,1,1.4%,1,2,1,2.4%,1,2,1,4.3%,All Peyton Hendershot red zone rushing plays,HendPe01
Zander Horvath,LAC,1,3,0,1.4%,1,3,0,2.6%,1,3,0,6.7%,All Zander Horvath red zone rushing plays,HorvZa00
Sam Howell,WAS,1,9,1,1.3%,1,9,1,2.3%,0,0,0,.0%,All Sam Howell red zone rushing plays,HoweSa00
Robert Hunt,MIA,1,0,0,2.0%,0,0,0,.0%,0,0,0,.0%,All Robert Hunt red zone rushing plays,HuntRo01
Andy Isabella,BAL,1,1,0,1.1%,0,0,0,.0%,0,0,0,.0%,All Andy Isabella red zone rushing plays,IsabAn00
Justin Jefferson,MIN,1,3,1,1.5%,1,3,1,2.2%,1,3,1,4.0%,All Justin Jefferson red zone rushing plays,JeffJu00
D'Ernest Johnson,CLE,1,4,0,1.3%,0,0,0,.0%,0,0,0,.0%,All D'Ernest Johnson red zone rushing plays,JohnDE04
Duke Johnson,BUF,1,4,0,1.3%,0,0,0,.0%,0,0,0,.0%,All Duke Johnson red zone rushing plays,JohnDu00
Josh Johnson,SFO,1,-1,0,1.0%,0,0,0,.0%,0,0,0,.0%,All Josh Johnson red zone rushing plays,JohnJo05
Ronald Jones,KAN,1,2,1,1.2%,1,2,1,2.2%,1,2,1,4.3%,All Ronald Jones red zone rushing plays,JoneRo01
Velus Jones,CHI,1,8,0,1.2%,0,0,0,.0%,0,0,0,.0%,All Velus Jones red zone rushing plays,JoneVe00
CeeDee Lamb,DAL,1,6,0,1.4%,0,0,0,.0%,0,0,0,.0%,All CeeDee Lamb red zone rushing plays,LambCe00
Marlon Mack,DEN,1,3,1,2.6%,1,3,1,3.6%,1,3,1,6.7%,All Marlon Mack red zone rushing plays,MackMa00
Anthony McFarland,PIT,1,3,0,1.4%,1,3,0,2.4%,0,0,0,.0%,All Anthony McFarland red zone rushing plays,McFaAn00
J.D. McKissic,WAS,1,1,0,1.3%,0,0,0,.0%,0,0,0,.0%,All J.D. McKissic red zone rushing plays,McKiJ.00
Trace McSorley,ARI,1,2,0,1.5%,0,0,0,.0%,0,0,0,.0%,All Trace McSorley red zone rushing plays,McSoTr00
Darnell Mooney,CHI,1,2,0,1.2%,0,0,0,.0%,0,0,0,.0%,All Darnell Mooney red zone rushing plays,MoonDa00
D.J. Moore,CAR,1,1,0,1.4%,0,0,0,.0%,0,0,0,.0%,All D.J. Moore red zone rushing plays,MoorD.00
Rondale Moore,ARI,1,-4,0,1.5%,1,-4,0,2.9%,0,0,0,.0%,All Rondale Moore red zone rushing plays,MoorRo02
Skyy Moore,KAN,1,3,0,1.2%,1,3,0,2.2%,0,0,0,.0%,All Skyy Moore red zone rushing plays,MoorSk01
Zach Pascal,PHI,1,0,0,.8%,1,0,0,1.4%,0,0,0,.0%,All Zach Pascal red zone rushing plays,PascZa00
George Pickens,PIT,1,1,1,1.4%,1,1,1,2.4%,1,1,1,4.2%,All George Pickens red zone rushing plays,PickGe00
Kalif Raymond,DET,1,8,0,1.1%,0,0,0,.0%,0,0,0,.0%,All Kalif Raymond red zone rushing plays,RaymKa00
Jalen Reagor,MIN,1,5,0,1.5%,0,0,0,.0%,0,0,0,.0%,All Jalen Reagor red zone rushing plays,ReagJa00
Craig Reynolds,DET,1,5,0,1.1%,0,0,0,.0%,0,0,0,.0%,All Craig Reynolds red zone rushing plays,ReynCr00
Ronnie Rivers,LAR,1,1,0,2.0%,0,0,0,.0%,0,0,0,.0%,All Ronnie Rivers red zone rushing plays,RiveRo01
Ben Skowronek,LAR,1,17,1,2.0%,0,0,0,.0%,0,0,0,.0%,All Ben Skowronek red zone rushing plays,SkowBe00
Matthew Stafford,LAR,1,1,1,2.0%,1,1,1,3.8%,1,1,1,7.1%,All Matthew Stafford red zone rushing plays,StafMa00
J.J. Taylor,NWE,1,-1,0,1.6%,1,-1,0,3.1%,1,-1,0,8.3%,All J.J. Taylor red zone rushing plays,TaylJJ01
Patrick Taylor,GNB,1,2,0,1.5%,1,2,0,3.1%,0,0,0,.0%,All Patrick Taylor red zone rushing plays,TaylPa01
DJ Turner,LVR,1,6,0,1.9%,0,0,0,.0%,0,0,0,.0%,All DJ Turner red zone rushing plays,TurnDJ00
KaVontae Turpin,DAL,1,3,0,1.4%,0,0,0,.0%,0,0,0,.0%,All KaVontae Turpin red zone rushing plays,TurpKa00
Dwayne Washington,NOR,1,3,0,1.8%,0,0,0,.0%,0,0,0,.0%,All Dwayne Washington red zone rushing plays,WashDw00
Montrell Washington,DEN,1,1,0,2.6%,1,1,0,3.6%,0,0,0,.0%,All Montrell Washington red zone rushing plays,WashMo00
Quez Watkins,PHI,1,4,0,.8%,0,0,0,.0%,0,0,0,.0%,All Quez Watkins red zone rushing plays,WatkQu00
Christian Watson,GNB,1,15,1,1.5%,0,0,0,.0%,0,0,0,.0%,All Christian Watson red zone rushing plays,WatsCh00
Davis Webb,NYG,1,14,1,1.4%,0,0,0,.0%,0,0,0,.0%,All Davis Webb red zone rushing plays,WebbDa00
Garrett Wilson,NYJ,1,7,0,1.6%,0,0,0,.0%,0,0,0,.0%,All Garrett Wilson red zone rushing plays,WilsGa00
Bailey Zappe,NWE,1,5,0,1.6%,0,0,0,.0%,0,0,0,.0%,All Bailey Zappe red zone rushing plays,ZappBa00