Clay Harbor,JAX,2,1,50.00%,3,0,4.70%,0,0,,0,0,0.00%,All Clay Harbor red zone receiving plays
Cory Harkey,STL,2,2,100.00%,6,1,4.30%,1,1,100.00%,4,1,3.40%,All Cory Harkey red zone receiving plays
Dan Herron,IND,2,1,50.00%,5,0,2.30%,1,1,100.00%,5,0,2.00%,All Dan Herron red zone receiving plays
Robert Hughes,ARI,2,1,50.00%,9,0,3.40%,0,0,,0,0,0.00%,All Robert Hughes red zone receiving plays
A.J. Jenkins,KAN,2,2,100.00%,10,0,3.20%,0,0,,0,0,0.00%,All A.J. Jenkins red zone receiving plays
Austin Johnson,NOR,2,2,100.00%,15,1,2.50%,1,1,100.00%,2,0,2.90%,All Austin Johnson red zone receiving plays
Marcedes Lewis,JAX,2,1,50.00%,4,1,4.70%,2,1,50.00%,4,1,13.30%,All Marcedes Lewis red zone receiving plays
Greg Little,CIN,2,1,50.00%,13,0,4.00%,0,0,,0,0,0.00%,All Greg Little red zone receiving plays
Tre Mason,STL,2,2,100.00%,19,0,4.30%,0,0,,0,0,0.00%,All Tre Mason red zone receiving plays
Joe McKnight,KAN,2,2,100.00%,15,2,3.20%,1,1,100.00%,4,1,4.20%,All Joe McKnight red zone receiving plays
Robert Meachem,NOR,2,1,50.00%,10,0,2.50%,0,0,,0,0,0.00%,All Robert Meachem red zone receiving plays
Bruce Miller,SFO,2,2,100.00%,11,2,4.70%,2,2,100.00%,11,2,9.50%,All Bruce Miller red zone receiving plays
Tony Moeaki,SEA,2,1,50.00%,1,1,3.60%,1,1,100.00%,1,1,4.00%,All Tony Moeaki red zone receiving plays
Jamize Olawale,OAK,2,2,100.00%,2,2,4.70%,2,2,100.00%,2,2,7.70%,All Jamize Olawale red zone receiving plays
Michael Palmer,PIT,2,1,50.00%,1,1,2.20%,2,1,50.00%,1,1,4.00%,All Michael Palmer red zone receiving plays
Brandon Pettigrew,DET,2,0,0.00%,0,0,2.70%,2,0,0.00%,0,0,5.40%,All Brandon Pettigrew red zone receiving plays
Anthony Sherman,KAN,2,2,100.00%,12,1,3.20%,0,0,,0,0,0.00%,All Anthony Sherman red zone receiving plays
C.J. Spiller,BUF,2,2,100.00%,14,1,3.00%,1,1,100.00%,7,1,4.50%,All C.J. Spiller red zone receiving plays
Zac Stacy,STL,2,0,0.00%,0,0,4.30%,1,0,0.00%,0,0,3.40%,All Zac Stacy red zone receiving plays
Brandon Tate,CIN,2,1,50.00%,5,1,4.00%,2,1,50.00%,5,1,12.50%,All Brandon Tate red zone receiving plays
Daniel Thomas,MIA,2,2,100.00%,3,0,2.30%,2,2,100.00%,3,0,4.30%,All Daniel Thomas red zone receiving plays
Kenbrell Thompkins,2TM,2,1,50.00%,3,0,,1,1,100.00%,3,0,,All Kenbrell Thompkins red zone receiving plays
Zurlon Tipton,IND,2,2,100.00%,7,1,2.30%,1,1,100.00%,1,1,2.00%,All Zurlon Tipton red zone receiving plays
Jordan Todman,JAX,2,1,50.00%,9,0,4.70%,0,0,,0,0,0.00%,All Jordan Todman red zone receiving plays
Trey Watts,STL,2,2,100.00%,12,0,4.30%,1,1,100.00%,1,0,3.40%,All Trey Watts red zone receiving plays
Eric Weems,ATL,2,2,100.00%,8,2,3.30%,2,2,100.00%,8,2,5.60%,All Eric Weems red zone receiving plays
Kerwynn Williams,ARI,2,1,50.00%,5,0,3.40%,2,1,50.00%,5,0,9.50%,All Kerwynn Williams red zone receiving plays
Albert Wilson,KAN,2,0,0.00%,0,0,3.20%,2,0,0.00%,0,0,8.30%,All Albert Wilson red zone receiving plays
Danny Woodhead,SDG,2,1,50.00%,7,0,2.80%,2,1,50.00%,7,0,4.70%,All Danny Woodhead red zone receiving plays
Ray Agnew,CLE,1,0,0.00%,0,0,2.40%,0,0,,0,0,0.00%,All Ray Agnew red zone receiving plays
Antonio Andrews,TEN,1,1,100.00%,5,0,1.80%,1,1,100.00%,5,0,3.20%,All Antonio Andrews red zone receiving plays
Dri Archer,PIT,1,1,100.00%,1,0,1.10%,1,1,100.00%,1,0,2.00%,All Dri Archer red zone receiving plays
Gary Barnidge,CLE,1,0,0.00%,0,0,2.40%,1,0,0.00%,0,0,5.00%,All Gary Barnidge red zone receiving plays
Jackie Battle,TEN,1,1,100.00%,9,0,1.80%,0,0,,0,0,0.00%,All Jackie Battle red zone receiving plays
Eben Britton,CHI,1,0,0.00%,0,0,1.30%,1,0,0.00%,0,0,2.10%,All Eben Britton red zone receiving plays
Kevin Brock,CIN,1,1,100.00%,2,0,2.00%,0,0,,0,0,0.00%,All Kevin Brock red zone receiving plays
Ronnie Brown,SDG,1,1,100.00%,2,0,1.40%,0,0,,0,0,0.00%,All Ronnie Brown red zone receiving plays
Ryan Broyles,DET,1,1,100.00%,4,0,1.30%,0,0,,0,0,0.00%,All Ryan Broyles red zone receiving plays
Andre Caldwell,DEN,1,1,100.00%,8,0,0.90%,0,0,,0,0,0.00%,All Andre Caldwell red zone receiving plays
James Casey,PHI,1,1,100.00%,14,1,1.30%,0,0,,0,0,0.00%,All James Casey red zone receiving plays
Anthony Castonzo,IND,1,1,100.00%,1,1,1.10%,1,1,100.00%,1,1,2.00%,All Anthony Castonzo red zone receiving plays
Derrick Coleman,SEA,1,1,100.00%,15,1,1.80%,0,0,,0,0,0.00%,All Derrick Coleman red zone receiving plays
Jed Collins,DET,1,1,100.00%,1,1,1.30%,1,1,100.00%,1,1,2.70%,All Jed Collins red zone receiving plays
John Conner,NYJ,1,1,100.00%,9,1,1.50%,1,1,100.00%,9,1,3.70%,All John Conner red zone receiving plays
Andy Dalton,CIN,1,1,100.00%,18,1,2.00%,0,0,,0,0,0.00%,All Andy Dalton red zone receiving plays
Orleans Darkwa,NYG,1,0,0.00%,0,0,1.00%,0,0,,0,0,0.00%,All Orleans Darkwa red zone receiving plays
Vernon Davis,SFO,1,1,100.00%,2,1,2.30%,1,1,100.00%,2,1,4.80%,All Vernon Davis red zone receiving plays
Maurice Jones-Drew,OAK,1,1,100.00%,11,0,2.30%,0,0,,0,0,0.00%,All Maurice Jones-Drew red zone receiving plays
Rhett Ellison,MIN,1,1,100.00%,7,1,2.50%,1,1,100.00%,7,1,5.60%,All Rhett Ellison red zone receiving plays
Jerome Felton,MIN,1,0,0.00%,0,0,2.50%,1,0,0.00%,0,0,5.60%,All Jerome Felton red zone receiving plays
C.J. Fiedorowicz,HOU,1,1,100.00%,5,1,1.50%,1,1,100.00%,5,1,3.40%,All C.J. Fiedorowicz red zone receiving plays
Chris Givens,STL,1,0,0.00%,0,0,2.10%,0,0,,0,0,0.00%,All Chris Givens red zone receiving plays
Marquise Goodwin,BUF,1,0,0.00%,0,0,1.50%,1,0,0.00%,0,0,4.50%,All Marquise Goodwin red zone receiving plays
T.J. Graham,NYJ,1,1,100.00%,9,0,1.50%,0,0,,0,0,0.00%,All T.J. Graham red zone receiving plays
MarQueis Gray,BUF,1,1,100.00%,7,0,1.50%,0,0,,0,0,0.00%,All MarQueis Gray red zone receiving plays
Shonn Greene,TEN,1,0,0.00%,0,0,1.80%,0,0,,0,0,0.00%,All Shonn Greene red zone receiving plays
Virgil Green,DEN,1,1,100.00%,1,1,0.90%,1,1,100.00%,1,1,1.90%,All Virgil Green red zone receiving plays
Derek Hagan,TEN,1,0,0.00%,0,0,1.80%,0,0,,0,0,0.00%,All Derek Hagan red zone receiving plays
James Hanna,DAL,1,0,0.00%,0,0,1.80%,0,0,,0,0,0.00%,All James Hanna red zone receiving plays
Dwayne Harris,DAL,1,0,0.00%,0,0,1.80%,0,0,,0,0,0.00%,All Dwayne Harris red zone receiving plays
Junior Hemingway,KAN,1,0,0.00%,0,0,1.60%,0,0,,0,0,0.00%,All Junior Hemingway red zone receiving plays
Robert Herron,TAM,1,1,100.00%,9,1,2.10%,1,1,100.00%,9,1,4.30%,All Robert Herron red zone receiving plays
Peyton Hillis,NYG,1,0,0.00%,0,0,1.00%,1,0,0.00%,0,0,1.90%,All Peyton Hillis red zone receiving plays
Shaun Hill,STL,1,1,100.00%,0,0,2.10%,0,0,,0,0,0.00%,All Shaun Hill red zone receiving plays
Santonio Holmes,CHI,1,0,0.00%,0,0,1.30%,0,0,,0,0,0.00%,All Santonio Holmes red zone receiving plays
Gator Hoskins,MIA,1,0,0.00%,0,0,1.10%,0,0,,0,0,0.00%,All Gator Hoskins red zone receiving plays
Josh Huff,PHI,1,1,100.00%,12,0,1.30%,0,0,,0,0,0.00%,All Josh Huff red zone receiving plays
Steven Jackson,ATL,1,0,0.00%,0,0,1.70%,0,0,,0,0,0.00%,All Steven Jackson red zone receiving plays
Nic Jacobs,JAX,1,1,100.00%,2,1,2.30%,1,1,100.00%,2,1,6.70%,All Nic Jacobs red zone receiving plays
Charles Johnson,MIN,1,0,0.00%,0,0,2.50%,1,0,0.00%,0,0,5.60%,All Charles Johnson red zone receiving plays
Jorvorskie Lane,TAM,1,1,100.00%,3,0,2.10%,1,1,100.00%,3,0,4.30%,All Jorvorskie Lane red zone receiving plays
Brian Leonhardt,OAK,1,1,100.00%,3,1,2.30%,1,1,100.00%,3,1,3.80%,All Brian Leonhardt red zone receiving plays
Brandon Lloyd,SFO,1,1,100.00%,5,0,2.30%,0,0,,0,0,0.00%,All Brandon Lloyd red zone receiving plays
Doug Martin,TAM,1,1,100.00%,3,0,2.10%,0,0,,0,0,0.00%,All Doug Martin red zone receiving plays
Keshawn Martin,HOU,1,1,100.00%,12,0,1.50%,0,0,,0,0,0.00%,All Keshawn Martin red zone receiving plays
Ryan Mathews,SDG,1,0,0.00%,0,0,1.40%,0,0,,0,0,0.00%,All Ryan Mathews red zone receiving plays
Vance McDonald,SFO,1,0,0.00%,0,0,2.30%,1,0,0.00%,0,0,4.80%,All Vance McDonald red zone receiving plays
Jerick McKinnon,MIN,1,1,100.00%,8,0,2.50%,0,0,,0,0,0.00%,All Jerick McKinnon red zone receiving plays
Christine Michael,SEA,1,0,0.00%,0,0,1.80%,0,0,,0,0,0.00%,All Christine Michael red zone receiving plays
Knowshon Moreno,MIA,1,1,100.00%,8,0,1.10%,0,0,,0,0,0.00%,All Knowshon Moreno red zone receiving plays
Alfred Morris,WAS,1,1,100.00%,2,0,1.60%,0,0,,0,0,0.00%,All Alfred Morris red zone receiving plays
Santana Moss,WAS,1,1,100.00%,7,0,1.60%,0,0,,0,0,0.00%,All Santana Moss red zone receiving plays
Latavius Murray,OAK,1,1,100.00%,7,0,2.30%,0,0,,0,0,0.00%,All Latavius Murray red zone receiving plays
Kevin Ogletree,NYG,1,0,0.00%,0,0,1.00%,0,0,,0,0,0.00%,All Kevin Ogletree red zone receiving plays
Chris Owusu,TAM,1,1,100.00%,19,1,2.10%,0,0,,0,0,0.00%,All Chris Owusu red zone receiving plays
Bear Pascoe,ATL,1,1,100.00%,1,1,1.70%,1,1,100.00%,1,1,2.80%,All Bear Pascoe red zone receiving plays
Donald Penn,OAK,1,1,100.00%,3,1,2.30%,1,1,100.00%,3,1,3.80%,All Donald Penn red zone receiving plays
Julius Peppers,GNB,1,0,0.00%,0,0,1.00%,1,0,0.00%,0,0,1.70%,All Julius Peppers red zone receiving plays
Adrian Peterson,MIN,1,1,100.00%,9,0,2.50%,0,0,,0,0,0.00%,All Adrian Peterson red zone receiving plays
John Phillips,SDG,1,1,100.00%,1,1,1.40%,1,1,100.00%,1,1,2.30%,All John Phillips red zone receiving plays
Chris Polk,PHI,1,0,0.00%,0,0,1.30%,1,0,0.00%,0,0,3.60%,All Chris Polk red zone receiving plays
Jay Prosch,HOU,1,0,0.00%,0,0,1.50%,0,0,,0,0,0.00%,All Jay Prosch red zone receiving plays
Darrin Reaves,CAR,1,0,0.00%,0,0,1.90%,1,0,0.00%,0,0,5.00%,All Darrin Reaves red zone receiving plays
Silas Redd,WAS,1,1,100.00%,8,0,1.60%,0,0,,0,0,0.00%,All Silas Redd red zone receiving plays
Adrien Robinson,NYG,1,1,100.00%,1,1,1.00%,1,1,100.00%,1,1,1.90%,All Adrien Robinson red zone receiving plays
Khiry Robinson,NOR,1,1,100.00%,17,0,1.30%,0,0,,0,0,0.00%,All Khiry Robinson red zone receiving plays
Greg Salas,NYJ,1,0,0.00%,0,0,1.50%,0,0,,0,0,0.00%,All Greg Salas red zone receiving plays
Bishop Sankey,TEN,1,1,100.00%,9,0,1.80%,0,0,,0,0,0.00%,All Bishop Sankey red zone receiving plays
Dane Sanzenbacher,CIN,1,0,0.00%,0,0,2.00%,0,0,,0,0,0.00%,All Dane Sanzenbacher red zone receiving plays
Antone Smith,ATL,1,1,100.00%,1,0,1.70%,1,1,100.00%,1,0,2.80%,All Antone Smith red zone receiving plays
Brad Smith,PHI,1,0,0.00%,0,0,1.30%,1,0,0.00%,0,0,3.60%,All Brad Smith red zone receiving plays
Geno Smith,NYJ,1,0,0.00%,0,0,1.50%,1,0,0.00%,0,0,3.70%,All Geno Smith red zone receiving plays
Lee Smith,BUF,1,1,100.00%,1,1,1.50%,1,1,100.00%,1,1,4.50%,All Lee Smith red zone receiving plays
James Starks,GNB,1,1,100.00%,2,0,1.00%,1,1,100.00%,2,0,1.70%,All James Starks red zone receiving plays
Jonathan Stewart,CAR,1,1,100.00%,9,1,1.90%,1,1,100.00%,9,1,5.00%,All Jonathan Stewart red zone receiving plays
Devin Street,DAL,1,1,100.00%,9,0,1.80%,0,0,,0,0,0.00%,All Devin Street red zone receiving plays
Rod Streater,OAK,1,1,100.00%,12,1,2.30%,0,0,,0,0,0.00%,All Rod Streater red zone receiving plays
Zach Sudfeld,NYJ,1,0,0.00%,0,0,1.50%,1,0,0.00%,0,0,3.70%,All Zach Sudfeld red zone receiving plays
Frank Summers,BUF,1,1,100.00%,2,0,1.50%,0,0,,0,0,0.00%,All Frank Summers red zone receiving plays
Will Ta'ufo'ou,JAX,1,0,0.00%,0,0,2.30%,0,0,,0,0,0.00%,All Will Ta'ufo'ou red zone receiving plays
Adam Thielen,MIN,1,1,100.00%,13,0,2.50%,0,0,,0,0,0.00%,All Adam Thielen red zone receiving plays
Chris Thompson,WAS,1,1,100.00%,9,1,1.60%,1,1,100.00%,9,1,5.00%,All Chris Thompson red zone receiving plays
Jordan Thompson,DET,1,0,0.00%,0,0,1.30%,0,0,,0,0,0.00%,All Jordan Thompson red zone receiving plays
Mike Tolbert,CAR,1,0,0.00%,0,0,1.90%,1,0,0.00%,0,0,5.00%,All Mike Tolbert red zone receiving plays
Fitzgerald Toussaint,BAL,1,1,100.00%,7,0,1.50%,0,0,,0,0,0.00%,All Fitzgerald Toussaint red zone receiving plays
Brian Tyms,NWE,1,1,100.00%,4,0,1.40%,1,1,100.00%,4,0,2.40%,All Brian Tyms red zone receiving plays
