Player,Tm,Tgt20,Rec20,Ctch%20,Yds20,TD20,%Tgt20,Tgt10,Rec10,Ctch%10,Yds10,TD10,%Tgt10,Link
Demaryius Thomas,DEN,39,18,46.15%,137,6,36.80%,18,6,33.33%,33,4,33.30%,All Demaryius Thomas red zone receiving plays
Antonio Brown,PIT,33,18,54.55%,133,8,36.70%,18,9,50.00%,45,6,36.00%,All Antonio Brown red zone receiving plays
Andre Johnson,HOU,26,12,46.15%,54,3,38.80%,11,5,45.45%,25,3,37.90%,All Andre Johnson red zone receiving plays
Odell Beckham,NYG,25,16,64.00%,122,8,25.50%,10,6,60.00%,42,6,19.20%,All Odell Beckham red zone receiving plays
Randall Cobb,GNB,25,16,64.00%,94,10,26.00%,14,10,71.43%,37,8,23.70%,All Randall Cobb red zone receiving plays
Jordy Nelson,GNB,25,12,48.00%,81,5,26.00%,17,7,41.18%,33,4,28.80%,All Jordy Nelson red zone receiving plays
Martellus Bennett,CHI,21,11,52.38%,86,5,26.90%,8,4,50.00%,18,2,17.00%,All Martellus Bennett red zone receiving plays
Jimmy Graham,NOR,21,12,57.14%,78,9,26.30%,11,7,63.64%,29,7,32.40%,All Jimmy Graham red zone receiving plays
Alshon Jeffery,CHI,21,9,42.86%,62,6,26.90%,19,7,36.84%,48,6,40.40%,All Alshon Jeffery red zone receiving plays
Larry Donnell,NYG,20,11,55.00%,64,6,20.40%,13,8,61.54%,37,5,25.00%,All Larry Donnell red zone receiving plays
Julian Edelman,NWE,20,12,60.00%,78,3,27.00%,9,4,44.44%,24,3,21.40%,All Julian Edelman red zone receiving plays
Charles Clay,MIA,19,8,42.11%,51,2,21.60%,13,3,23.08%,8,1,27.70%,All Charles Clay red zone receiving plays
Antonio Gates,SDG,19,10,52.63%,64,9,26.80%,16,8,50.00%,45,8,37.20%,All Antonio Gates red zone receiving plays
Rueben Randle,NYG,19,8,42.11%,57,3,19.40%,10,4,40.00%,20,3,19.20%,All Rueben Randle red zone receiving plays
Emmanuel Sanders,DEN,19,16,84.21%,84,6,17.90%,13,11,84.62%,39,5,24.10%,All Emmanuel Sanders red zone receiving plays
Mike Wallace,MIA,19,13,68.42%,113,9,21.60%,8,6,75.00%,42,6,17.00%,All Mike Wallace red zone receiving plays
Steve Smith,BAL,18,8,44.44%,46,2,26.90%,6,2,33.33%,5,1,18.80%,All Steve Smith red zone receiving plays
Rob Gronkowski,NWE,16,11,68.75%,81,9,21.60%,8,6,75.00%,24,6,19.00%,All Rob Gronkowski red zone receiving plays
Kelvin Benjamin,CAR,15,4,26.67%,39,3,28.80%,9,2,22.22%,12,2,45.00%,All Kelvin Benjamin red zone receiving plays
Anquan Boldin,SFO,15,8,53.33%,76,2,34.90%,5,1,20.00%,7,0,23.80%,All Anquan Boldin red zone receiving plays
Brandon Marshall,CHI,15,7,46.67%,53,6,19.20%,9,4,44.44%,18,4,19.10%,All Brandon Marshall red zone receiving plays
Jordan Matthews,PHI,15,10,66.67%,96,6,19.70%,2,2,100.00%,18,1,7.10%,All Jordan Matthews red zone receiving plays
Greg Olsen,CAR,15,10,66.67%,100,5,28.80%,5,4,80.00%,27,3,25.00%,All Greg Olsen red zone receiving plays
Mohamed Sanu,CIN,15,6,40.00%,56,2,30.00%,3,1,33.33%,6,1,18.80%,All Mohamed Sanu red zone receiving plays
Julius Thomas,DEN,15,13,86.67%,94,9,14.20%,10,8,80.00%,36,7,18.50%,All Julius Thomas red zone receiving plays
Dez Bryant,DAL,14,8,57.14%,67,8,25.50%,10,5,50.00%,17,5,38.50%,All Dez Bryant red zone receiving plays
Riley Cooper,PHI,14,5,35.71%,44,3,18.40%,6,3,50.00%,20,2,21.40%,All Riley Cooper red zone receiving plays
Eric Decker,NYJ,14,9,64.29%,47,3,20.90%,7,4,57.14%,14,2,25.90%,All Eric Decker red zone receiving plays
Vincent Jackson,TAM,14,3,21.43%,18,2,29.20%,7,2,28.57%,8,2,30.40%,All Vincent Jackson red zone receiving plays
Hakeem Nicks,IND,14,5,35.71%,27,3,16.10%,8,4,50.00%,22,3,15.70%,All Hakeem Nicks red zone receiving plays
Cecil Shorts,JAX,14,4,28.57%,24,1,32.60%,6,2,33.33%,14,1,40.00%,All Cecil Shorts red zone receiving plays
Le'Veon Bell,PIT,13,10,76.92%,37,3,14.40%,8,6,75.00%,24,3,16.00%,All Le'Veon Bell red zone receiving plays
Ahmad Bradshaw,IND,13,12,92.31%,63,6,14.90%,9,8,88.89%,36,5,17.60%,All Ahmad Bradshaw red zone receiving plays
Jamaal Charles,KAN,13,7,53.85%,64,4,20.60%,6,3,50.00%,16,2,25.00%,All Jamaal Charles red zone receiving plays
Marques Colston,NOR,13,6,46.15%,55,3,16.30%,5,2,40.00%,12,2,14.70%,All Marques Colston red zone receiving plays
Mike Evans,TAM,13,8,61.54%,77,6,27.10%,5,4,80.00%,26,4,21.70%,All Mike Evans red zone receiving plays
Matt Forte,CHI,13,8,61.54%,69,3,16.70%,5,3,60.00%,26,2,10.60%,All Matt Forte red zone receiving plays
Jermaine Gresham,CIN,13,9,69.23%,40,5,26.00%,7,5,71.43%,15,4,43.80%,All Jermaine Gresham red zone receiving plays
Calvin Johnson,DET,13,4,30.77%,32,4,17.30%,6,3,50.00%,16,3,16.20%,All Calvin Johnson red zone receiving plays
Brandon LaFell,NWE,13,6,46.15%,60,5,17.60%,7,3,42.86%,21,3,16.70%,All Brandon LaFell red zone receiving plays
Jarvis Landry,MIA,13,11,84.62%,82,5,14.80%,4,4,100.00%,17,3,8.50%,All Jarvis Landry red zone receiving plays
Andrew Quarless,GNB,13,5,38.46%,33,3,13.50%,8,3,37.50%,18,3,13.60%,All Andrew Quarless red zone receiving plays
Torrey Smith,BAL,13,8,61.54%,84,6,19.40%,5,3,60.00%,27,3,15.60%,All Torrey Smith red zone receiving plays
Roddy White,ATL,13,9,69.23%,36,6,21.70%,10,7,70.00%,22,6,27.80%,All Roddy White red zone receiving plays
Keenan Allen,SDG,12,6,50.00%,40,2,16.90%,4,1,25.00%,2,1,9.30%,All Keenan Allen red zone receiving plays
Doug Baldwin,SEA,12,8,66.67%,48,2,21.40%,7,5,71.43%,20,2,28.00%,All Doug Baldwin red zone receiving plays
Owen Daniels,BAL,12,7,58.33%,33,4,17.90%,7,4,57.14%,11,4,21.90%,All Owen Daniels red zone receiving plays
Zach Ertz,PHI,12,3,25.00%,29,1,15.80%,6,1,16.67%,4,0,21.40%,All Zach Ertz red zone receiving plays
Coby Fleener,IND,12,7,58.33%,48,5,13.80%,7,5,71.43%,28,5,13.70%,All Coby Fleener red zone receiving plays
DeAndre Hopkins,HOU,12,6,50.00%,47,2,17.90%,4,2,50.00%,14,1,13.80%,All DeAndre Hopkins red zone receiving plays
Greg Jennings,MIN,12,8,66.67%,85,5,30.00%,6,4,66.67%,27,3,33.30%,All Greg Jennings red zone receiving plays
Jeremy Maclin,PHI,12,6,50.00%,41,3,15.80%,6,3,50.00%,15,3,21.40%,All Jeremy Maclin red zone receiving plays
Heath Miller,PIT,12,8,66.67%,37,3,13.30%,7,6,85.71%,21,2,14.00%,All Heath Miller red zone receiving plays
Delanie Walker,TEN,12,4,33.33%,22,3,21.40%,9,4,44.44%,22,3,29.00%,All Delanie Walker red zone receiving plays
Terrance Williams,DAL,12,7,58.33%,63,5,21.80%,5,3,60.00%,17,3,19.20%,All Terrance Williams red zone receiving plays
Robert Woods,BUF,12,7,58.33%,49,3,18.20%,5,3,60.00%,20,3,22.70%,All Robert Woods red zone receiving plays
Davante Adams,GNB,11,6,54.55%,47,2,11.50%,6,3,50.00%,18,1,10.20%,All Davante Adams red zone receiving plays
Reggie Bush,DET,11,5,45.45%,18,0,14.70%,4,2,50.00%,8,0,10.80%,All Reggie Bush red zone receiving plays
Scott Chandler,BUF,11,6,54.55%,51,2,16.70%,3,1,33.33%,1,0,13.60%,All Scott Chandler red zone receiving plays
A.J. Green,CIN,11,6,54.55%,71,3,22.00%,3,1,33.33%,5,0,18.80%,All A.J. Green red zone receiving plays
T.Y. Hilton,IND,11,4,36.36%,22,2,12.60%,6,2,33.33%,4,2,11.80%,All T.Y. Hilton red zone receiving plays
Julio Jones,ATL,11,7,63.64%,59,2,18.30%,5,2,40.00%,16,1,13.90%,All Julio Jones red zone receiving plays
Travis Kelce,KAN,11,8,72.73%,56,3,17.50%,5,2,40.00%,4,2,20.80%,All Travis Kelce red zone receiving plays
Eddie Royal,SDG,11,6,54.55%,30,4,15.50%,7,3,42.86%,9,3,16.30%,All Eddie Royal red zone receiving plays
Golden Tate,DET,11,9,81.82%,64,2,14.70%,4,3,75.00%,19,2,10.80%,All Golden Tate red zone receiving plays
Shane Vereen,NWE,11,5,45.45%,20,2,14.90%,9,4,44.44%,12,2,21.40%,All Shane Vereen red zone receiving plays
Larry Fitzgerald,ARI,10,7,70.00%,63,0,17.20%,3,2,66.67%,11,0,14.30%,All Larry Fitzgerald red zone receiving plays
Malcom Floyd,SDG,10,7,70.00%,58,4,14.10%,4,3,75.00%,15,2,9.30%,All Malcom Floyd red zone receiving plays
Arian Foster,HOU,10,5,50.00%,29,4,14.90%,5,4,80.00%,23,4,17.20%,All Arian Foster red zone receiving plays
Pierre Garcon,WAS,10,3,30.00%,18,2,16.10%,5,2,40.00%,9,2,25.00%,All Pierre Garcon red zone receiving plays
DeSean Jackson,WAS,10,5,50.00%,33,1,16.10%,1,0,0.00%,0,0,5.00%,All DeSean Jackson red zone receiving plays
James Jones,OAK,10,7,70.00%,40,5,23.30%,7,6,85.71%,32,5,26.90%,All James Jones red zone receiving plays
Eddie Lacy,GNB,10,6,60.00%,24,2,10.40%,6,3,50.00%,14,2,10.20%,All Eddie Lacy red zone receiving plays
Marshawn Lynch,SEA,10,6,60.00%,51,4,17.90%,5,3,60.00%,16,2,20.00%,All Marshawn Lynch red zone receiving plays
Jordan Reed,WAS,10,5,50.00%,18,0,16.10%,6,2,33.33%,9,0,30.00%,All Jordan Reed red zone receiving plays
Theo Riddick,DET,10,8,80.00%,52,4,13.30%,5,3,60.00%,20,3,13.50%,All Theo Riddick red zone receiving plays
Andre Roberts,WAS,10,6,60.00%,58,2,16.10%,1,1,100.00%,6,1,5.00%,All Andre Roberts red zone receiving plays
Sammy Watkins,BUF,10,4,40.00%,24,3,15.20%,3,2,66.67%,7,2,13.60%,All Sammy Watkins red zone receiving plays
Jace Amaro,NYJ,9,5,55.56%,30,2,13.40%,3,2,66.67%,7,2,11.10%,All Jace Amaro red zone receiving plays
John Carlson,ARI,9,3,33.33%,8,1,15.50%,5,2,40.00%,10,1,23.80%,All John Carlson red zone receiving plays
Jared Cook,STL,9,4,44.44%,28,1,19.10%,5,1,20.00%,1,1,17.20%,All Jared Cook red zone receiving plays
Michael Crabtree,SFO,9,6,66.67%,18,2,20.90%,4,4,100.00%,6,2,19.00%,All Michael Crabtree red zone receiving plays
Jeff Cumberland,NYJ,9,4,44.44%,25,1,13.40%,3,1,33.33%,10,1,11.10%,All Jeff Cumberland red zone receiving plays
Taylor Gabriel,CLE,9,5,55.56%,22,0,21.40%,2,1,50.00%,5,0,10.00%,All Taylor Gabriel red zone receiving plays
Percy Harvin,2TM,9,5,55.56%,15,0,,3,1,33.33%,1,0,,All Percy Harvin red zone receiving plays
Chris Hogan,BUF,9,5,55.56%,35,3,13.60%,3,3,100.00%,17,2,13.60%,All Chris Hogan red zone receiving plays
Jeremy Kerley,NYJ,9,4,44.44%,45,1,13.40%,2,0,0.00%,0,0,7.40%,All Jeremy Kerley red zone receiving plays
Nate Washington,TEN,9,3,33.33%,19,0,16.10%,5,1,20.00%,5,0,16.10%,All Nate Washington red zone receiving plays
Wes Welker,DEN,9,6,66.67%,29,1,8.50%,5,4,80.00%,19,1,9.30%,All Wes Welker red zone receiving plays
Dwayne Allen,IND,8,7,87.50%,32,5,9.20%,7,6,85.71%,20,5,13.70%,All Dwayne Allen red zone receiving plays
Joique Bell,DET,8,5,62.50%,29,1,10.70%,3,1,33.33%,5,1,8.10%,All Joique Bell red zone receiving plays
Dwayne Bowe,KAN,8,5,62.50%,42,0,12.70%,3,1,33.33%,5,0,12.50%,All Dwayne Bowe red zone receiving plays
Brent Celek,PHI,8,3,37.50%,11,1,10.50%,5,2,40.00%,4,1,17.90%,All Brent Celek red zone receiving plays
Jack Doyle,IND,8,5,62.50%,13,2,9.20%,6,4,66.67%,12,2,11.80%,All Jack Doyle red zone receiving plays
Allen Hurns,JAX,8,4,50.00%,34,2,18.60%,3,2,66.67%,9,1,20.00%,All Allen Hurns red zone receiving plays
Jermaine Kearse,SEA,8,1,12.50%,15,1,14.30%,5,0,0.00%,0,0,20.00%,All Jermaine Kearse red zone receiving plays
Lamar Miller,MIA,8,6,75.00%,26,1,9.10%,5,4,80.00%,22,1,10.60%,All Lamar Miller red zone receiving plays
Preston Parker,NYG,8,2,25.00%,9,2,8.20%,3,2,66.67%,9,2,5.80%,All Preston Parker red zone receiving plays
Reggie Wayne,IND,8,2,25.00%,15,0,9.20%,3,1,33.33%,-2,0,5.90%,All Reggie Wayne red zone receiving plays
Jason Witten,DAL,8,4,50.00%,18,3,14.50%,5,4,80.00%,18,3,19.20%,All Jason Witten red zone receiving plays
Kendall Wright,TEN,8,5,62.50%,48,5,14.30%,3,2,66.67%,12,2,9.70%,All Kendall Wright red zone receiving plays
C.J. Anderson,DEN,7,7,100.00%,50,1,6.60%,0,0,,0,0,0.00%,All C.J. Anderson red zone receiving plays
Martavis Bryant,PIT,7,4,57.14%,44,4,7.80%,4,2,50.00%,7,2,8.00%,All Martavis Bryant red zone receiving plays
Harry Douglas,ATL,7,5,71.43%,22,2,11.70%,6,4,66.67%,16,2,16.70%,All Harry Douglas red zone receiving plays
Brian Hartline,MIA,7,5,71.43%,18,2,8.00%,4,2,50.00%,4,2,8.50%,All Brian Hartline red zone receiving plays
Andrew Hawkins,CLE,7,6,85.71%,26,1,16.70%,3,2,66.67%,6,1,15.00%,All Andrew Hawkins red zone receiving plays
Devin Hester,ATL,7,3,42.86%,31,1,11.70%,3,0,0.00%,0,0,8.30%,All Devin Hester red zone receiving plays
Ronnie Hillman,DEN,7,4,57.14%,45,1,6.60%,2,1,50.00%,3,0,3.70%,All Ronnie Hillman red zone receiving plays
Justin Hunter,TEN,7,3,42.86%,25,1,12.50%,3,1,33.33%,4,0,9.70%,All Justin Hunter red zone receiving plays
Chris Ivory,NYJ,7,5,71.43%,31,1,10.40%,4,3,75.00%,23,1,14.80%,All Chris Ivory red zone receiving plays
Fred Jackson,BUF,7,3,42.86%,25,1,10.60%,1,0,0.00%,0,0,4.50%,All Fred Jackson red zone receiving plays
Dexter McCluster,TEN,7,4,57.14%,19,1,12.50%,4,3,75.00%,15,1,12.90%,All Dexter McCluster red zone receiving plays
Mychal Rivera,OAK,7,6,85.71%,39,4,16.30%,5,4,80.00%,13,3,19.20%,All Mychal Rivera red zone receiving plays
Markus Wheaton,PIT,7,3,42.86%,34,1,7.80%,2,0,0.00%,0,0,4.00%,All Markus Wheaton red zone receiving plays
Tim Wright,NWE,7,6,85.71%,33,6,9.50%,5,5,100.00%,16,5,11.90%,All Tim Wright red zone receiving plays
Kamar Aiken,BAL,6,5,83.33%,47,3,9.00%,3,2,66.67%,9,1,9.40%,All Kamar Aiken red zone receiving plays
Miles Austin,CLE,6,3,50.00%,20,2,14.30%,4,2,50.00%,7,2,20.00%,All Miles Austin red zone receiving plays
Cole Beasley,DAL,6,5,83.33%,51,1,10.90%,1,1,100.00%,5,0,3.80%,All Cole Beasley red zone receiving plays
Kenny Britt,STL,6,3,50.00%,16,0,12.80%,4,1,25.00%,8,0,13.80%,All Kenny Britt red zone receiving plays
Jaron Brown,ARI,6,5,83.33%,37,1,10.30%,2,1,50.00%,1,0,9.50%,All Jaron Brown red zone receiving plays
John Brown,ARI,6,2,33.33%,12,1,10.30%,3,0,0.00%,0,0,14.30%,All John Brown red zone receiving plays
Justin Brown,PIT,6,3,50.00%,18,0,6.70%,4,2,50.00%,11,0,8.00%,All Justin Brown red zone receiving plays
Brandin Cooks,NOR,6,4,66.67%,14,1,7.50%,2,2,100.00%,2,1,5.90%,All Brandin Cooks red zone receiving plays
Jerricho Cotchery,CAR,6,5,83.33%,22,1,11.50%,1,1,100.00%,2,1,5.00%,All Jerricho Cotchery red zone receiving plays
Benny Cunningham,STL,6,5,83.33%,31,1,12.80%,4,3,75.00%,18,1,13.80%,All Benny Cunningham red zone receiving plays
Gavin Escobar,DAL,6,3,50.00%,23,3,10.90%,5,2,40.00%,8,2,19.20%,All Gavin Escobar red zone receiving plays
Joseph Fauria,DET,6,2,33.33%,18,1,8.00%,6,2,33.33%,18,1,16.20%,All Joseph Fauria red zone receiving plays
Brandon Gibson,MIA,6,2,33.33%,10,1,6.80%,4,1,25.00%,7,1,8.50%,All Brandon Gibson red zone receiving plays
Cooper Helfet,SEA,6,2,33.33%,26,1,10.70%,1,1,100.00%,7,0,4.00%,All Cooper Helfet red zone receiving plays
Josh Hill,NOR,6,5,83.33%,28,4,7.50%,5,4,80.00%,16,3,14.70%,All Josh Hill red zone receiving plays
Kyle Juszczyk,BAL,6,3,50.00%,21,1,9.00%,3,3,100.00%,21,1,9.40%,All Kyle Juszczyk red zone receiving plays
Lance Kendricks,STL,6,4,66.67%,14,3,12.80%,5,3,60.00%,6,3,17.20%,All Lance Kendricks red zone receiving plays
Marqise Lee,JAX,6,0,0.00%,0,0,14.00%,3,0,0.00%,0,0,20.00%,All Marqise Lee red zone receiving plays
Lance Moore,PIT,6,2,33.33%,10,1,6.70%,4,1,25.00%,3,1,8.00%,All Lance Moore red zone receiving plays
Louis Murphy,TAM,6,3,50.00%,14,1,12.50%,4,2,50.00%,7,1,17.40%,All Louis Murphy red zone receiving plays
Branden Oliver,SDG,6,5,83.33%,14,1,8.50%,5,4,80.00%,11,1,11.60%,All Branden Oliver red zone receiving plays
Richard Rodgers,GNB,6,3,50.00%,9,1,6.30%,4,2,50.00%,4,1,6.80%,All Richard Rodgers red zone receiving plays
Darren Sproles,PHI,6,3,50.00%,13,0,7.90%,0,0,,0,0,0.00%,All Darren Sproles red zone receiving plays
Jacob Tamme,DEN,6,3,50.00%,7,1,5.70%,4,1,25.00%,4,1,7.40%,All Jacob Tamme red zone receiving plays
De'Anthony Thomas,KAN,6,5,83.33%,17,0,9.50%,1,0,0.00%,0,0,4.20%,All De'Anthony Thomas red zone receiving plays
Damien Williams,MIA,6,4,66.67%,15,1,6.80%,4,3,75.00%,9,1,8.50%,All Damien Williams red zone receiving plays
Matt Asiata,MIN,5,4,80.00%,20,0,12.50%,0,0,,0,0,0.00%,All Matt Asiata red zone receiving plays
Travis Benjamin,CLE,5,3,60.00%,32,3,11.90%,2,2,100.00%,15,2,10.00%,All Travis Benjamin red zone receiving plays
Donald Brown,SDG,5,3,60.00%,4,0,7.00%,1,0,0.00%,0,0,2.30%,All Donald Brown red zone receiving plays
Travaris Cadet,NOR,5,3,60.00%,20,1,6.30%,1,1,100.00%,5,1,2.90%,All Travaris Cadet red zone receiving plays
Knile Davis,KAN,5,2,40.00%,14,0,7.90%,2,1,50.00%,6,0,8.30%,All Knile Davis red zone receiving plays
Eric Ebron,DET,5,2,40.00%,20,1,6.70%,3,0,0.00%,0,0,8.10%,All Eric Ebron red zone receiving plays
Andre Ellington,ARI,5,4,80.00%,5,1,8.60%,2,2,100.00%,6,1,9.50%,All Andre Ellington red zone receiving plays
Daniel Fells,NYG,5,3,60.00%,12,3,5.10%,5,3,60.00%,12,3,9.60%,All Daniel Fells red zone receiving plays
Michael Floyd,ARI,5,1,20.00%,12,1,8.60%,0,0,,0,0,0.00%,All Michael Floyd red zone receiving plays
Devonta Freeman,ATL,5,4,80.00%,33,1,8.30%,1,1,100.00%,7,1,2.80%,All Devonta Freeman red zone receiving plays
Roy Helu,WAS,5,3,60.00%,11,0,8.10%,1,0,0.00%,0,0,5.00%,All Roy Helu red zone receiving plays
Carlos Hyde,SFO,5,3,60.00%,20,0,11.60%,2,1,50.00%,8,0,9.50%,All Carlos Hyde red zone receiving plays
Mark Ingram,NOR,5,5,100.00%,22,0,6.30%,1,1,100.00%,2,0,2.90%,All Mark Ingram red zone receiving plays
Damaris Johnson,HOU,5,2,40.00%,8,0,7.50%,1,0,0.00%,0,0,3.40%,All Damaris Johnson red zone receiving plays
LeSean McCoy,PHI,5,4,80.00%,10,0,6.60%,1,1,100.00%,3,0,3.60%,All LeSean McCoy red zone receiving plays
Trent Richardson,IND,5,3,60.00%,6,0,5.70%,1,0,0.00%,0,0,2.00%,All Trent Richardson red zone receiving plays
Allen Robinson,JAX,5,2,40.00%,7,0,11.60%,0,0,,0,0,0.00%,All Allen Robinson red zone receiving plays
Levine Toilolo,ATL,5,3,60.00%,14,2,8.30%,3,2,66.67%,2,2,8.30%,All Levine Toilolo red zone receiving plays
Ben Watson,NOR,5,3,60.00%,22,2,6.30%,2,1,50.00%,7,1,5.90%,All Ben Watson red zone receiving plays
Andre Williams,NYG,5,2,40.00%,4,0,5.10%,3,1,33.33%,0,0,5.80%,All Andre Williams red zone receiving plays
Luke Willson,SEA,5,0,0.00%,0,0,8.90%,2,0,0.00%,0,0,8.00%,All Luke Willson red zone receiving plays
Mike Williams,BUF,5,0,0.00%,0,0,7.60%,2,0,0.00%,0,0,9.10%,All Mike Williams red zone receiving plays
Jarius Wright,MIN,5,2,40.00%,14,1,12.50%,2,1,50.00%,8,1,11.10%,All Jarius Wright red zone receiving plays
Jason Avant,2TM,4,2,50.00%,21,1,,0,0,,0,0,,All Jason Avant red zone receiving plays
Donnie Avery,KAN,4,2,50.00%,8,0,6.30%,2,1,50.00%,3,0,8.30%,All Donnie Avery red zone receiving plays
Stedman Bailey,STL,4,3,75.00%,19,1,8.50%,4,3,75.00%,19,1,13.80%,All Stedman Bailey red zone receiving plays
Giovani Bernard,CIN,4,4,100.00%,40,1,8.00%,1,1,100.00%,2,0,6.30%,All Giovani Bernard red zone receiving plays
Brice Butler,OAK,4,1,25.00%,5,1,9.30%,3,1,33.33%,5,1,11.50%,All Brice Butler red zone receiving plays
Chase Coffman,TEN,4,1,25.00%,4,1,7.10%,3,1,33.33%,4,1,9.70%,All Chase Coffman red zone receiving plays
Victor Cruz,NYG,4,2,50.00%,10,0,4.10%,2,1,50.00%,3,0,3.80%,All Victor Cruz red zone receiving plays
Patrick DiMarco,ATL,4,1,25.00%,1,1,6.70%,2,1,50.00%,1,1,5.60%,All Patrick DiMarco red zone receiving plays
Anthony Fasano,KAN,4,4,100.00%,38,3,6.30%,2,2,100.00%,7,2,8.30%,All Anthony Fasano red zone receiving plays
Chase Ford,MIN,4,1,25.00%,7,0,10.00%,3,0,0.00%,0,0,16.70%,All Chase Ford red zone receiving plays
Garrett Graham,HOU,4,1,25.00%,6,0,6.00%,3,0,0.00%,0,0,10.30%,All Garrett Graham red zone receiving plays
Andre Holmes,OAK,4,3,75.00%,19,2,9.30%,4,3,75.00%,19,2,15.40%,All Andre Holmes red zone receiving plays
Rob Housler,ARI,4,1,25.00%,13,0,6.90%,0,0,,0,0,0.00%,All Rob Housler red zone receiving plays
Rashad Jennings,NYG,4,2,50.00%,10,0,4.10%,2,1,50.00%,8,0,3.80%,All Rashad Jennings red zone receiving plays
Stevie Johnson,SFO,4,3,75.00%,25,3,9.30%,2,2,100.00%,13,2,9.50%,All Stevie Johnson red zone receiving plays
Erik Lorig,NOR,4,3,75.00%,5,1,5.00%,3,2,66.67%,3,1,8.80%,All Erik Lorig red zone receiving plays
DeMarco Murray,DAL,4,4,100.00%,19,0,7.30%,0,0,,0,0,0.00%,All DeMarco Murray red zone receiving plays
Brandon Myers,TAM,4,3,75.00%,20,0,8.30%,2,1,50.00%,4,0,8.70%,All Brandon Myers red zone receiving plays
Niles Paul,WAS,4,3,75.00%,10,1,6.50%,2,2,100.00%,2,1,10.00%,All Niles Paul red zone receiving plays
Marcel Reece,OAK,4,3,75.00%,17,1,9.30%,2,1,50.00%,9,1,7.70%,All Marcel Reece red zone receiving plays
Paul Richardson,SEA,4,2,50.00%,19,1,7.10%,2,1,50.00%,10,1,8.00%,All Paul Richardson red zone receiving plays
Austin Seferian-Jenkins,TAM,4,2,50.00%,8,2,8.30%,2,2,100.00%,8,2,8.70%,All Austin Seferian-Jenkins red zone receiving plays
Kenny Stills,NOR,4,3,75.00%,13,1,5.00%,3,3,100.00%,13,1,8.80%,All Kenny Stills red zone receiving plays
Stepfan Taylor,ARI,4,4,100.00%,15,3,6.90%,4,4,100.00%,15,3,19.00%,All Stepfan Taylor red zone receiving plays
Corey Washington,NYG,4,3,75.00%,18,1,4.10%,2,1,50.00%,1,1,3.80%,All Corey Washington red zone receiving plays
Leon Washington,TEN,4,4,100.00%,19,2,7.10%,3,3,100.00%,13,2,9.70%,All Leon Washington red zone receiving plays
Terrance West,CLE,4,3,75.00%,13,1,9.50%,2,1,50.00%,2,1,10.00%,All Terrance West red zone receiving plays
Danny Amendola,NWE,3,2,66.67%,23,1,4.10%,1,0,0.00%,0,0,2.40%,All Danny Amendola red zone receiving plays
LeGarrette Blount,PIT,3,2,66.67%,10,0,3.30%,0,0,,0,0,0.00%,All LeGarrette Blount red zone receiving plays
Jordan Cameron,CLE,3,0,0.00%,0,0,7.10%,3,0,0.00%,0,0,15.00%,All Jordan Cameron red zone receiving plays
Ed Dickson,CAR,3,2,66.67%,15,1,5.80%,1,1,100.00%,5,1,5.00%,All Ed Dickson red zone receiving plays
Jim Dray,CLE,3,2,66.67%,6,1,7.10%,2,1,50.00%,1,1,10.00%,All Jim Dray red zone receiving plays
Bruce Ellington,SFO,3,1,33.33%,8,1,7.00%,3,1,33.33%,8,1,14.30%,All Bruce Ellington red zone receiving plays
Justin Forsett,BAL,3,0,0.00%,0,0,4.50%,3,0,0.00%,0,0,9.40%,All Justin Forsett red zone receiving plays
Corey Fuller,DET,3,1,33.33%,5,1,4.00%,2,1,50.00%,5,1,5.40%,All Corey Fuller red zone receiving plays
Crockett Gillmore,BAL,3,1,33.33%,1,1,4.50%,3,1,33.33%,1,1,9.40%,All Crockett Gillmore red zone receiving plays
Josh Gordon,CLE,3,0,0.00%,0,0,7.10%,1,0,0.00%,0,0,5.00%,All Josh Gordon red zone receiving plays
Ryan Grant,WAS,3,0,0.00%,0,0,4.80%,0,0,,0,0,0.00%,All Ryan Grant red zone receiving plays
Ladarius Green,SDG,3,1,33.33%,4,0,4.20%,3,1,33.33%,4,0,7.00%,All Ladarius Green red zone receiving plays
Marion Grice,ARI,3,1,33.33%,-3,0,5.20%,0,0,,0,0,0.00%,All Marion Grice red zone receiving plays
Chris Johnson,NYJ,3,2,66.67%,7,1,4.50%,1,1,100.00%,5,1,3.70%,All Chris Johnson red zone receiving plays
Rishard Matthews,MIA,3,1,33.33%,3,1,3.40%,2,1,50.00%,3,1,4.30%,All Rishard Matthews red zone receiving plays
Darren McFadden,OAK,3,1,33.33%,6,0,7.00%,0,0,,0,0,0.00%,All Darren McFadden red zone receiving plays
Donte Moncrief,IND,3,2,66.67%,6,0,3.40%,1,0,0.00%,0,0,2.00%,All Donte Moncrief red zone receiving plays
Denarius Moore,OAK,3,0,0.00%,0,0,7.00%,1,0,0.00%,0,0,3.80%,All Denarius Moore red zone receiving plays
Josh Morgan,CHI,3,2,66.67%,12,1,3.80%,3,2,66.67%,12,1,6.40%,All Josh Morgan red zone receiving plays
David Nelson,NYJ,3,0,0.00%,0,0,4.50%,2,0,0.00%,0,0,7.40%,All David Nelson red zone receiving plays
Cordarrelle Patterson,MIN,3,1,33.33%,4,1,7.50%,1,1,100.00%,4,1,5.60%,All Cordarrelle Patterson red zone receiving plays
Logan Paulsen,WAS,3,1,33.33%,16,1,4.80%,1,0,0.00%,0,0,5.00%,All Logan Paulsen red zone receiving plays
Austin Pettis,STL,3,2,66.67%,7,1,6.40%,2,2,100.00%,7,1,6.90%,All Austin Pettis red zone receiving plays
Dennis Pitta,BAL,3,0,0.00%,0,0,4.50%,1,0,0.00%,0,0,3.10%,All Dennis Pitta red zone receiving plays
Bilal Powell,NYJ,3,3,100.00%,23,0,4.50%,0,0,,0,0,0.00%,All Bilal Powell red zone receiving plays
Brian Quick,STL,3,3,100.00%,18,2,6.40%,2,2,100.00%,13,2,6.90%,All Brian Quick red zone receiving plays
Bobby Rainey,TAM,3,1,33.33%,6,1,6.30%,1,1,100.00%,6,1,4.30%,All Bobby Rainey red zone receiving plays
Jacquizz Rodgers,ATL,3,2,66.67%,10,1,5.00%,2,1,50.00%,8,1,5.60%,All Jacquizz Rodgers red zone receiving plays
Jeremy Ross,DET,3,1,33.33%,13,0,4.00%,1,0,0.00%,0,0,2.70%,All Jeremy Ross red zone receiving plays
Kyle Rudolph,MIN,3,3,100.00%,20,2,7.50%,2,2,100.00%,11,2,11.10%,All Kyle Rudolph red zone receiving plays
Dion Sims,MIA,3,3,100.00%,35,2,3.40%,1,1,100.00%,3,0,2.10%,All Dion Sims red zone receiving plays
Pierre Thomas,NOR,3,3,100.00%,30,1,3.80%,0,0,,0,0,0.00%,All Pierre Thomas red zone receiving plays
Nick Toon,NOR,3,3,100.00%,27,1,3.80%,0,0,,0,0,0.00%,All Nick Toon red zone receiving plays
Robert Turbin,SEA,3,3,100.00%,25,2,5.40%,1,1,100.00%,3,1,4.00%,All Robert Turbin red zone receiving plays
J.J. Watt,HOU,3,3,100.00%,4,3,4.50%,3,3,100.00%,4,3,10.30%,All J.J. Watt red zone receiving plays
Brandon Williams,CAR,3,1,33.33%,6,0,5.80%,0,0,,0,0,0.00%,All Brandon Williams red zone receiving plays
Marquess Wilson,CHI,3,1,33.33%,1,1,3.80%,2,1,50.00%,1,1,4.30%,All Marquess Wilson red zone receiving plays
Darrel Young,WAS,3,1,33.33%,4,1,4.80%,2,1,50.00%,4,1,10.00%,All Darrel Young red zone receiving plays
Montee Ball,DEN,2,1,50.00%,4,0,1.90%,1,1,100.00%,4,0,1.90%,All Montee Ball red zone receiving plays
Joe Banyard,MIN,2,2,100.00%,11,0,5.00%,1,1,100.00%,1,0,5.60%,All Joe Banyard red zone receiving plays
Brenton Bersin,CAR,2,2,100.00%,12,1,3.80%,1,1,100.00%,1,1,5.00%,All Brenton Bersin red zone receiving plays
Alfred Blue,HOU,2,2,100.00%,18,1,3.00%,0,0,,0,0,0.00%,All Alfred Blue red zone receiving plays
Brandon Bostick,GNB,2,2,100.00%,3,1,2.10%,1,1,100.00%,1,1,1.70%,All Brandon Bostick red zone receiving plays
Jarrett Boykin,GNB,2,0,0.00%,0,0,2.10%,1,0,0.00%,0,0,1.70%,All Jarrett Boykin red zone receiving plays
Bryce Brown,BUF,2,1,50.00%,8,0,3.00%,0,0,,0,0,0.00%,All Bryce Brown red zone receiving plays
Corey Brown,CAR,2,0,0.00%,0,0,3.80%,0,0,,0,0,0.00%,All Corey Brown red zone receiving plays
Michael Campanaro,BAL,2,1,50.00%,19,1,3.00%,1,0,0.00%,0,0,3.10%,All Michael Campanaro red zone receiving plays
James Develin,NWE,2,1,50.00%,4,0,2.70%,1,0,0.00%,0,0,2.40%,All James Develin red zone receiving plays
Anthony Dixon,BUF,2,2,100.00%,10,0,3.00%,0,0,,0,0,0.00%,All Anthony Dixon red zone receiving plays
Lance Dunbar,DAL,2,2,100.00%,21,0,3.60%,0,0,,0,0,0.00%,All Lance Dunbar red zone receiving plays
Toby Gerhart,JAX,2,2,100.00%,10,0,4.70%,0,0,,0,0,0.00%,All Toby Gerhart red zone receiving plays
Ted Ginn,ARI,2,0,0.00%,0,0,3.40%,0,0,,0,0,0.00%,All Ted Ginn red zone receiving plays
Frank Gore,SFO,2,0,0.00%,0,0,4.70%,1,0,0.00%,0,0,4.80%,All Frank Gore red zone receiving plays
Chris Gragg,BUF,2,1,50.00%,2,1,3.00%,2,1,50.00%,2,1,9.10%,All Chris Gragg red zone receiving plays
Ryan Griffin,HOU,2,2,100.00%,19,1,3.00%,1,1,100.00%,8,1,3.40%,All Ryan Griffin red zone receiving plays
Frankie Hammond,KAN,2,0,0.00%,0,0,3.20%,0,0,,0,0,0.00%,All Frankie Hammond red zone receiving plays
