Player,Tm,ins_20_att,ins_20_yds,ins_20_tds,ins_20_%rush,ins_10_att,ins_10_yds,ins_10_tds,ins_10_%rush,ins_5_att,ins_5_yds,ins_5_tds,ins_5_%rush,link,-9999
Ezekiel Elliott,DAL,59,162,11,77.6%,31,57,11,77.5%,12,18,9,80.0%,All Ezekiel Elliott red zone rushing plays,ElliEz00
Christian McCaffrey,CAR,54,143,11,80.6%,32,62,10,80.0%,17,15,8,81.0%,All Christian McCaffrey red zone rushing plays,McCaCh01
Todd Gurley,LAR,51,139,12,63.0%,29,50,11,55.8%,12,12,6,54.5%,All Todd Gurley red zone rushing plays,GurlTo01
Nick Chubb,CLE,50,82,6,74.6%,32,12,4,74.4%,15,-14,2,78.9%,All Nick Chubb red zone rushing plays,ChubNi00
Dalvin Cook,MIN,43,114,12,47.8%,32,62,11,52.5%,15,22,9,62.5%,All Dalvin Cook red zone rushing plays,CookDa01
Leonard Fournette,JAX,43,58,3,69.4%,23,14,3,76.7%,8,-2,3,100.0%,All Leonard Fournette red zone rushing plays,FourLe00
Derrick Henry,TEN,42,144,13,76.4%,24,52,10,82.8%,10,10,7,83.3%,All Derrick Henry red zone rushing plays,HenrDe00
Josh Jacobs,OAK,41,131,7,65.1%,21,31,5,61.8%,10,14,5,52.6%,All Josh Jacobs red zone rushing plays,JacoJo01
Sony Michel,NWE,41,67,7,51.2%,27,38,6,50.0%,12,14,5,46.2%,All Sony Michel red zone rushing plays,MichSo00
Mark Ingram,BAL,40,130,10,38.5%,26,43,9,45.6%,15,14,8,53.6%,All Mark Ingram red zone rushing plays,IngrMa01
Joe Mixon,CIN,40,95,5,71.4%,25,38,5,75.8%,16,12,4,76.2%,All Joe Mixon red zone rushing plays,MixoJo00
Chris Carson,SEA,39,102,7,56.5%,20,24,6,55.6%,9,1,5,52.9%,All Chris Carson red zone rushing plays,CarsCh00
Aaron Jones,GNB,33,116,14,60.0%,19,37,11,61.3%,13,14,8,72.2%,All Aaron Jones red zone rushing plays,JoneAa00
David Montgomery,CHI,33,64,6,64.7%,23,36,5,69.7%,14,11,5,87.5%,All David Montgomery red zone rushing plays,MontDa01
Carlos Hyde,HOU,32,83,5,52.5%,16,30,5,53.3%,8,9,4,42.1%,All Carlos Hyde red zone rushing plays,HydeCa00
Marlon Mack,IND,32,91,7,44.4%,17,34,6,43.6%,8,4,3,42.1%,All Marlon Mack red zone rushing plays,MackMa00
Melvin Gordon,LAC,30,73,8,51.7%,20,32,7,55.6%,13,15,6,61.9%,All Melvin Gordon red zone rushing plays,GordMe00
Saquon Barkley,NYG,28,74,3,59.6%,16,33,3,53.3%,7,-1,1,53.8%,All Saquon Barkley red zone rushing plays,BarkSa00
Tevin Coleman,SFO,27,67,5,35.1%,15,15,3,37.5%,8,4,3,36.4%,All Tevin Coleman red zone rushing plays,ColeTe01
Phillip Lindsay,DEN,27,76,5,45.8%,12,25,5,41.4%,8,14,5,57.1%,All Phillip Lindsay red zone rushing plays,LindPh00
Lamar Jackson,BAL,26,93,5,25.0%,14,36,5,24.6%,5,4,3,17.9%,All Lamar Jackson red zone rushing plays,JackLa00
Alvin Kamara,NOR,26,94,4,37.7%,14,26,3,38.9%,7,7,3,53.8%,All Alvin Kamara red zone rushing plays,KamaAl00
Alexander Mattison,MIN,26,111,1,28.9%,14,40,1,23.0%,2,1,0,8.3%,All Alexander Mattison red zone rushing plays,MattAl01
Frank Gore,BUF,25,35,2,36.8%,18,4,2,54.5%,11,0,2,61.1%,All Frank Gore red zone rushing plays,GoreFr00
Miles Sanders,PHI,25,70,2,33.3%,14,27,2,35.0%,6,-1,2,28.6%,All Miles Sanders red zone rushing plays,SandMi01
Royce Freeman,DEN,24,66,3,40.7%,13,13,3,44.8%,4,6,3,28.6%,All Royce Freeman red zone rushing plays,FreeRo00
Latavius Murray,NOR,23,79,3,33.3%,14,42,3,38.9%,3,6,2,23.1%,All Latavius Murray red zone rushing plays,MurrLa00
Adrian Peterson,WAS,23,63,5,52.3%,11,19,4,52.4%,7,3,3,50.0%,All Adrian Peterson red zone rushing plays,PeteAd01
Peyton Barber,TAM,22,56,6,39.3%,13,17,4,36.1%,8,5,4,40.0%,All Peyton Barber red zone rushing plays,BarbPe01
Kenyan Drake,2TM,22,64,7,,13,27,6,,6,9,5,,All Kenyan Drake red zone rushing plays,DrakKe00
Jordan Howard,PHI,22,86,6,29.3%,12,25,5,30.0%,8,12,5,38.1%,All Jordan Howard red zone rushing plays,HowaJo00
Josh Allen,BUF,21,74,9,30.9%,11,39,8,33.3%,5,7,5,27.8%,All Josh Allen red zone rushing plays,AlleJo02
Gus Edwards,BAL,20,50,1,19.2%,10,5,0,17.5%,6,2,0,21.4%,All Gus Edwards red zone rushing plays,EdwaGu00
Devonta Freeman,ATL,20,73,2,36.4%,3,2,0,14.3%,1,0,0,9.1%,All Devonta Freeman red zone rushing plays,FreeDe00
Kerryon Johnson,DET,20,32,3,39.2%,15,17,3,42.9%,9,6,3,64.3%,All Kerryon Johnson red zone rushing plays,JohnKe06
Benny Snell,PIT,20,48,2,33.9%,10,0,2,30.3%,3,4,2,23.1%,All Benny Snell red zone rushing plays,SnelBe00
Le'Veon Bell,NYJ,19,44,3,59.4%,9,23,3,69.2%,5,5,3,71.4%,All Le'Veon Bell red zone rushing plays,BellLe00
Ronald Jones,TAM,18,53,6,32.1%,10,29,6,27.8%,2,8,2,10.0%,All Ronald Jones red zone rushing plays,JoneRo01
LeSean McCoy,KAN,18,40,4,26.9%,12,22,4,34.3%,7,8,3,41.2%,All LeSean McCoy red zone rushing plays,McCoLe01
Devin Singletary,BUF,18,64,2,26.5%,3,6,1,9.1%,2,4,1,11.1%,All Devin Singletary red zone rushing plays,SingDe00
Kyler Murray,ARI,17,56,3,29.3%,7,9,2,25.9%,3,-5,0,21.4%,All Kyler Murray red zone rushing plays,MurrKy00
Kalen Ballage,MIA,16,35,3,27.1%,12,15,3,36.4%,7,5,3,46.7%,All Kalen Ballage red zone rushing plays,BallKa00
Austin Ekeler,LAC,16,19,3,27.6%,11,12,3,30.6%,7,4,2,33.3%,All Austin Ekeler red zone rushing plays,EkelAu00
Ryan Fitzpatrick,MIA,16,46,4,27.1%,8,17,2,24.2%,4,-5,1,26.7%,All Ryan Fitzpatrick red zone rushing plays,FitzRy00
Jeff Wilson,SFO,16,41,4,20.8%,10,26,4,25.0%,5,11,4,22.7%,All Jeff Wilson red zone rushing plays,WilsJe01
Malcolm Brown,LAR,15,45,5,18.5%,10,22,5,19.2%,6,7,3,27.3%,All Malcolm Brown red zone rushing plays,BrowMa03
David Johnson,ARI,15,26,2,25.9%,7,11,2,25.9%,5,4,2,35.7%,All David Johnson red zone rushing plays,JohnDa08
Damien Williams,KAN,15,34,3,22.4%,8,15,3,22.9%,3,5,2,17.6%,All Damien Williams red zone rushing plays,WillDa05
Raheem Mostert,SFO,14,87,6,18.2%,6,15,3,15.0%,5,5,2,22.7%,All Raheem Mostert red zone rushing plays,MostRa00
Dak Prescott,DAL,14,46,3,18.4%,9,31,3,22.5%,3,7,1,20.0%,All Dak Prescott red zone rushing plays,PresDa01
Deshaun Watson,HOU,14,38,6,23.0%,8,18,6,26.7%,6,12,5,31.6%,All Deshaun Watson red zone rushing plays,WatsDe00
James Conner,PIT,13,38,4,22.0%,7,14,3,21.2%,5,5,2,38.5%,All James Conner red zone rushing plays,ConnJa00
DeAndre Washington,OAK,13,37,3,20.6%,7,13,2,20.6%,3,4,1,15.8%,All DeAndre Washington red zone rushing plays,WashDe00
James White,NWE,13,28,1,16.3%,6,11,1,11.1%,3,2,1,11.5%,All James White red zone rushing plays,WhitJa02
Mike Boone,MIN,12,39,3,13.3%,9,32,3,14.8%,2,3,2,8.3%,All Mike Boone red zone rushing plays,BoonMi00
Jacoby Brissett,IND,12,33,4,16.7%,7,16,4,17.9%,3,4,2,15.8%,All Jacoby Brissett red zone rushing plays,BrisJa00
Qadree Ollison,ATL,12,29,4,21.8%,8,13,4,38.1%,5,7,4,45.5%,All Qadree Ollison red zone rushing plays,OlliQa00
Boston Scott,PHI,12,47,5,16.0%,8,31,5,20.0%,4,10,4,19.0%,All Boston Scott red zone rushing plays,ScotBo02
Jamaal Williams,GNB,12,28,1,21.8%,5,7,1,16.1%,2,-2,1,11.1%,All Jamaal Williams red zone rushing plays,WillJa06
Russell Wilson,SEA,12,59,3,17.4%,6,12,2,16.7%,4,2,1,23.5%,All Russell Wilson red zone rushing plays,WilsRu00
Tom Brady,NWE,11,8,3,13.8%,10,9,3,18.5%,5,5,3,19.2%,All Tom Brady red zone rushing plays,BradTo00
Jaylen Samuels,PIT,11,11,1,18.6%,7,-4,1,21.2%,2,5,1,15.4%,All Jaylen Samuels red zone rushing plays,SamuJa00
Carson Wentz,PHI,11,38,1,14.7%,5,10,1,12.5%,2,3,1,9.5%,All Carson Wentz red zone rushing plays,WentCa00
Darrel Williams,KAN,11,11,3,16.4%,7,10,3,20.0%,5,4,2,29.4%,All Darrel Williams red zone rushing plays,WillDa10
Jared Goff,LAR,10,6,2,12.3%,8,3,2,15.4%,4,2,2,18.2%,All Jared Goff red zone rushing plays,GoffJa00
Brian Hill,ATL,10,37,1,18.2%,4,14,1,19.0%,1,3,1,9.1%,All Brian Hill red zone rushing plays,HillBr02
Justice Hill,BAL,10,61,2,9.6%,2,8,1,3.5%,1,0,0,3.6%,All Justice Hill red zone rushing plays,HillJu00
Patrick Laird,MIA,10,23,1,16.9%,5,1,1,15.2%,1,4,1,6.7%,All Patrick Laird red zone rushing plays,LairPa00
Gardner Minshew,JAX,10,23,0,16.1%,4,10,0,13.3%,0,0,0,.0%,All Gardner Minshew red zone rushing plays,MinsGa00
Jordan Wilkins,IND,10,31,2,13.9%,6,-2,2,15.4%,4,3,2,21.1%,All Jordan Wilkins red zone rushing plays,WilkJo01
Giovani Bernard,CIN,9,25,0,16.1%,3,5,0,9.1%,1,0,0,4.8%,All Giovani Bernard red zone rushing plays,BernGi00
Teddy Bridgewater,NOR,9,6,0,13.0%,4,0,0,11.1%,1,0,0,7.7%,All Teddy Bridgewater red zone rushing plays,BridTe00
Rex Burkhead,NWE,9,18,2,11.3%,5,6,2,9.3%,2,3,2,7.7%,All Rex Burkhead red zone rushing plays,BurkRe00
Jimmy Garoppolo,SFO,9,5,1,11.7%,4,1,1,10.0%,1,1,1,4.5%,All Jimmy Garoppolo red zone rushing plays,GaroJi00
Duke Johnson,HOU,9,29,2,14.8%,2,2,2,6.7%,2,2,2,10.5%,All Duke Johnson red zone rushing plays,JohnDu00
Aaron Rodgers,GNB,9,19,1,16.4%,7,11,1,22.6%,3,1,1,16.7%,All Aaron Rodgers red zone rushing plays,RodgAa00
Ito Smith,ATL,9,18,1,16.4%,5,4,1,23.8%,3,0,1,27.3%,All Ito Smith red zone rushing plays,SmitIt00
Darwin Thompson,KAN,9,12,1,13.4%,3,6,1,8.6%,1,4,1,5.9%,All Darwin Thompson red zone rushing plays,ThomDa06
Nyheim Hines,IND,8,26,2,11.1%,5,15,2,12.8%,2,4,1,10.5%,All Nyheim Hines red zone rushing plays,HineNy00
Rashaad Penny,SEA,8,29,1,11.6%,4,10,1,11.1%,2,4,1,11.8%,All Rashaad Penny red zone rushing plays,PennRa00
Jonathan Williams,IND,8,25,1,11.1%,2,7,0,5.1%,1,1,0,5.3%,All Jonathan Williams red zone rushing plays,WillJo07
Jameis Winston,TAM,8,5,1,14.3%,5,1,1,13.9%,2,1,1,10.0%,All Jameis Winston red zone rushing plays,WinsJa00
Ryquell Armstead,JAX,7,7,0,11.3%,3,8,0,10.0%,0,0,0,.0%,All Ryquell Armstead red zone rushing plays,ArmsRy00
Andy Dalton,CIN,7,19,4,12.5%,5,11,4,15.2%,4,6,3,19.0%,All Andy Dalton red zone rushing plays,DaltAn00
Derrius Guice,WAS,7,11,2,15.9%,3,2,2,14.3%,3,2,2,21.4%,All Derrius Guice red zone rushing plays,GuicDe00
Ty Johnson,DET,7,16,0,13.7%,5,11,0,14.3%,1,1,0,7.1%,All Ty Johnson red zone rushing plays,JohnTy02
Patrick Mahomes,KAN,7,45,2,10.4%,3,11,0,8.6%,0,0,0,.0%,All Patrick Mahomes red zone rushing plays,MahoPa00
Baker Mayfield,CLE,7,31,3,10.4%,6,20,3,14.0%,1,1,1,5.3%,All Baker Mayfield red zone rushing plays,MayfBa00
Dare Ogunbowale,TAM,7,2,2,12.5%,7,2,2,19.4%,7,2,2,35.0%,All Dare Ogunbowale red zone rushing plays,OgunDa00
Tarik Cohen,CHI,6,16,0,11.8%,4,9,0,12.1%,1,0,0,6.3%,All Tarik Cohen red zone rushing plays,CoheTa00
Sam Darnold,NYJ,6,19,2,18.8%,3,9,2,23.1%,2,6,2,28.6%,All Sam Darnold red zone rushing plays,DarnSa00
Wayne Gallman,NYG,6,10,2,12.8%,4,4,2,13.3%,4,4,2,30.8%,All Wayne Gallman red zone rushing plays,GallWa00
Robert Griffin,BAL,6,4,0,5.8%,4,5,0,7.0%,0,0,0,.0%,All Robert Griffin red zone rushing plays,GrifRo01
Taysom Hill,NOR,6,1,0,8.7%,2,-2,0,5.6%,0,0,0,.0%,All Taysom Hill red zone rushing plays,HillTa00
Devlin Hodges,PIT,6,-3,0,10.2%,5,-9,0,15.2%,2,-10,0,15.4%,All Devlin Hodges red zone rushing plays,HodgDe00
Bo Scarbrough,DET,6,23,1,11.8%,4,17,1,11.4%,0,0,0,.0%,All Bo Scarbrough red zone rushing plays,ScarBo01
Chris Thompson,WAS,6,13,0,13.6%,4,10,0,19.0%,2,2,0,14.3%,All Chris Thompson red zone rushing plays,ThomCh03
Mitchell Trubisky,CHI,6,15,1,11.8%,3,11,1,9.1%,1,2,1,6.3%,All Mitchell Trubisky red zone rushing plays,TrubMi00
Brandon Bolden,NWE,5,18,3,6.3%,5,18,3,9.3%,3,6,2,11.5%,All Brandon Bolden red zone rushing plays,BoldBr00
Chase Edmonds,ARI,5,5,0,8.6%,1,2,0,3.7%,0,0,0,.0%,All Chase Edmonds red zone rushing plays,EdmoCh00
Myles Gaskin,MIA,5,4,1,8.5%,2,-2,1,6.1%,1,2,1,6.7%,All Myles Gaskin red zone rushing plays,GaskMy00
Dontrell Hilliard,CLE,5,22,2,7.5%,3,7,2,7.0%,2,5,2,10.5%,All Dontrell Hilliard red zone rushing plays,HillDo00
Justin Jackson,LAC,5,9,0,8.6%,1,0,0,2.8%,0,0,0,.0%,All Justin Jackson red zone rushing plays,JackJu01
Daniel Jones,NYG,5,37,2,10.6%,3,16,2,10.0%,1,2,0,7.7%,All Daniel Jones red zone rushing plays,JoneDa05
J.D. McKissic,DET,5,19,0,9.8%,3,-1,0,8.6%,0,0,0,.0%,All J.D. McKissic red zone rushing plays,McKiJ.00
Bilal Powell,NYJ,5,4,0,15.6%,1,0,0,7.7%,0,0,0,.0%,All Bilal Powell red zone rushing plays,PoweBi00
Kyle Allen,CAR,4,19,2,6.0%,3,2,1,7.5%,2,1,1,9.5%,All Kyle Allen red zone rushing plays,AlleKy00
Matt Breida,SFO,4,3,0,5.2%,2,-2,0,5.0%,1,-2,0,4.5%,All Matt Breida red zone rushing plays,BreiMa00
Derek Carr,OAK,4,10,2,6.3%,3,7,2,8.8%,3,7,2,15.8%,All Derek Carr red zone rushing plays,CarrDe02
Jeff Driskel,DET,4,4,1,7.8%,3,2,1,8.6%,1,2,1,7.1%,All Jeff Driskel red zone rushing plays,DrisJe00
Trey Edmunds,PIT,4,2,0,6.8%,1,-2,0,3.0%,1,-2,0,7.7%,All Trey Edmunds red zone rushing plays,EdmuTr00
Kareem Hunt,CLE,4,18,2,6.0%,2,9,2,4.7%,1,3,1,5.3%,All Kareem Hunt red zone rushing plays,HuntKa00
Marcus Mariota,TEN,4,21,0,7.3%,2,13,0,6.9%,0,0,0,.0%,All Marcus Mariota red zone rushing plays,MariMa01
C.J. Prosise,SEA,4,14,1,5.8%,3,9,1,8.3%,1,1,0,5.9%,All C.J. Prosise red zone rushing plays,ProsC.00
Curtis Samuel,CAR,4,28,1,6.0%,2,12,1,5.0%,0,0,0,.0%,All Curtis Samuel red zone rushing plays,SamuCu00
Ryan Tannehill,TEN,4,20,3,7.3%,3,14,3,10.3%,2,4,2,16.7%,All Ryan Tannehill red zone rushing plays,TannRy00
Derek Watt,LAC,4,8,1,6.9%,3,5,1,8.3%,1,1,1,4.8%,All Derek Watt red zone rushing plays,WattDe00
Kirk Cousins,MIN,3,4,1,3.3%,3,4,1,4.9%,2,0,1,8.3%,All Kirk Cousins red zone rushing plays,CousKi00
Jon Hilliman,NYG,3,9,0,6.4%,2,7,0,6.7%,0,0,0,.0%,All Jon Hilliman red zone rushing plays,HillJo03
Wes Hills,DET,3,5,2,5.9%,3,5,2,8.6%,3,5,2,21.4%,All Wes Hills red zone rushing plays,HillWe00
Travis Homer,SEA,3,-4,0,4.3%,2,-1,0,5.6%,0,0,0,.0%,All Travis Homer red zone rushing plays,HomeTr00
Alec Ingold,OAK,3,2,0,4.8%,3,2,0,8.8%,3,2,0,15.8%,All Alec Ingold red zone rushing plays,IngoAl01
Case Keenum,WAS,3,-1,1,6.8%,2,1,1,9.5%,2,1,1,14.3%,All Case Keenum red zone rushing plays,KeenCa00
Dion Lewis,TEN,3,17,0,5.5%,0,0,0,.0%,0,0,0,.0%,All Dion Lewis red zone rushing plays,LewiDi00
Marshawn Lynch,SEA,3,2,1,4.3%,1,1,1,2.8%,1,1,1,5.9%,All Marshawn Lynch red zone rushing plays,LyncMa00
Cordarrelle Patterson,CHI,3,13,0,5.9%,2,10,0,6.1%,0,0,0,.0%,All Cordarrelle Patterson red zone rushing plays,PattCo00
Matt Ryan,ATL,3,10,1,5.5%,1,1,1,4.8%,1,1,1,9.1%,All Matt Ryan red zone rushing plays,RyanMa00
Mark Walton,MIA,3,-3,0,5.1%,2,-5,0,6.1%,2,-5,0,13.3%,All Mark Walton red zone rushing plays,WaltMa00
Ameer Abdullah,MIN,2,14,0,2.2%,0,0,0,.0%,0,0,0,.0%,All Ameer Abdullah red zone rushing plays,AbduAm00
Jay Ajayi,PHI,2,2,0,2.7%,0,0,0,.0%,0,0,0,.0%,All Jay Ajayi red zone rushing plays,AjayJa00
C.J. Anderson,DET,2,1,0,3.9%,0,0,0,.0%,0,0,0,.0%,All C.J. Anderson red zone rushing plays,AndeC.00
Alex Armah,CAR,2,1,1,3.0%,2,1,1,5.0%,2,1,1,9.5%,All Alex Armah red zone rushing plays,ArmaAl00
Dalyn Dawkins,TEN,2,3,0,3.6%,0,0,0,.0%,0,0,0,.0%,All Dalyn Dawkins red zone rushing plays,DawkDa01
Joe Flacco,DEN,2,3,0,3.4%,2,3,0,6.9%,1,1,0,7.1%,All Joe Flacco red zone rushing plays,FlacJo00
Taylor Gabriel,CHI,2,21,0,3.9%,0,0,0,.0%,0,0,0,.0%,All Taylor Gabriel red zone rushing plays,GabrTa00
Jakeem Grant,MIA,2,5,1,3.4%,2,5,1,6.1%,0,0,0,.0%,All Jakeem Grant red zone rushing plays,GranJa00
C.J. Ham,MIN,2,-1,0,2.2%,2,-1,0,3.3%,2,-1,0,8.3%,All C.J. Ham red zone rushing plays,HamxC.00
Dwayne Haskins,WAS,2,18,0,4.5%,1,4,0,4.8%,0,0,0,.0%,All Dwayne Haskins red zone rushing plays,HaskDw00
Darrell Henderson,LAR,2,4,0,2.5%,2,4,0,3.8%,0,0,0,.0%,All Darrell Henderson red zone rushing plays,HendDa00
Tyreek Hill,KAN,2,10,0,3.0%,0,0,0,.0%,0,0,0,.0%,All Tyreek Hill red zone rushing plays,HillTy00
Buddy Howell,HOU,2,4,0,3.3%,1,1,0,3.3%,1,1,0,5.3%,All Buddy Howell red zone rushing plays,HoweGr00
Brett Hundley,ARI,2,18,0,3.4%,1,6,0,3.7%,0,0,0,.0%,All Brett Hundley red zone rushing plays,HundBr00
Richie James,SFO,2,-1,0,2.6%,1,-1,0,2.5%,0,0,0,.0%,All Richie James red zone rushing plays,JameRi00
George Kittle,SFO,2,-5,0,2.6%,1,-2,0,2.5%,1,-2,0,4.5%,All George Kittle red zone rushing plays,KittGe00
Drew Lock,DEN,2,-3,0,3.4%,0,0,0,.0%,0,0,0,.0%,All Drew Lock red zone rushing plays,LockDr00
D.J. Moore,CAR,2,9,0,3.0%,1,-3,0,2.5%,0,0,0,.0%,All D.J. Moore red zone rushing plays,MoorD.00
Devine Ozigbo,JAX,2,3,0,3.2%,0,0,0,.0%,0,0,0,.0%,All Devine Ozigbo red zone rushing plays,OzigDe01
Elijhaa Penny,NYG,2,6,0,4.3%,2,6,0,6.7%,0,0,0,.0%,All Elijhaa Penny red zone rushing plays,PennEl00
Tony Pollard,DAL,2,26,1,2.6%,0,0,0,.0%,0,0,0,.0%,All Tony Pollard red zone rushing plays,PollTo00
Troymaine Pope,LAC,2,-1,0,3.4%,0,0,0,.0%,0,0,0,.0%,All Troymaine Pope red zone rushing plays,PopeTr00
Jalen Richard,OAK,2,7,0,3.2%,0,0,0,.0%,0,0,0,.0%,All Jalen Richard red zone rushing plays,RichJa01
Mason Rudolph,PIT,2,2,0,3.4%,2,2,0,6.1%,0,0,0,.0%,All Mason Rudolph red zone rushing plays,RudoMa00
Deebo Samuel,SFO,2,21,1,2.6%,0,0,0,.0%,0,0,0,.0%,All Deebo Samuel red zone rushing plays,SamuDe00
Wendell Smallwood,WAS,2,0,0,4.5%,0,0,0,.0%,0,0,0,.0%,All Wendell Smallwood red zone rushing plays,SmalWe00
Keith Smith,ATL,2,5,0,3.6%,0,0,0,.0%,0,0,0,.0%,All Keith Smith red zone rushing plays,SmitKe03
Darren Sproles,PHI,2,6,0,2.7%,0,0,0,.0%,0,0,0,.0%,All Darren Sproles red zone rushing plays,SproDa00
Matthew Stafford,DET,2,4,0,3.9%,1,4,0,2.9%,0,0,0,.0%,All Matthew Stafford red zone rushing plays,StafMa00
Spencer Ware,KAN,2,6,0,3.0%,1,1,0,2.9%,0,0,0,.0%,All Spencer Ware red zone rushing plays,WareSp00
Kerrith Whyte,PIT,2,4,0,3.4%,1,-1,0,3.0%,0,0,0,.0%,All Kerrith Whyte red zone rushing plays,WhytKe00
Albert Wilson,MIA,2,12,0,3.4%,0,0,0,.0%,0,0,0,.0%,All Albert Wilson red zone rushing plays,WilsAl02
Robert Woods,LAR,2,8,1,2.5%,2,8,1,3.8%,0,0,0,.0%,All Robert Woods red zone rushing plays,WoodRo02
T.J. Yeldon,BUF,2,2,0,2.9%,1,0,0,3.0%,0,0,0,.0%,All T.J. Yeldon red zone rushing plays,YeldT.00
Brandon Allen,DEN,1,11,0,1.7%,0,0,0,.0%,0,0,0,.0%,All Brandon Allen red zone rushing plays,AlleBr00
Javorius Allen,NYG,1,1,1,2.1%,1,1,1,3.3%,1,1,1,7.7%,All Javorius Allen red zone rushing plays,AlleJa01
Tavon Austin,DAL,1,2,0,1.3%,0,0,0,.0%,0,0,0,.0%,All Tavon Austin red zone rushing plays,AustTa00
Odell Beckham,CLE,1,11,0,1.5%,0,0,0,.0%,0,0,0,.0%,All Odell Beckham red zone rushing plays,BeckOd00
David Blough,DET,1,5,0,2.0%,1,5,0,2.9%,0,0,0,.0%,All David Blough red zone rushing plays,BlouDa00
Drew Brees,NOR,1,1,1,1.4%,1,1,1,2.8%,1,1,1,7.7%,All Drew Brees red zone rushing plays,BreeDr00
Tra Carson,DET,1,2,0,2.0%,0,0,0,.0%,0,0,0,.0%,All Tra Carson red zone rushing plays,CarsTr01
Keke Coutee,HOU,1,4,1,1.6%,1,4,1,3.3%,1,4,1,5.3%,All Keke Coutee red zone rushing plays,CoutKe00
Chase Daniel,CHI,1,2,0,2.0%,1,2,0,3.0%,0,0,0,.0%,All Chase Daniel red zone rushing plays,DaniCh00
James Develin,NWE,1,1,0,1.3%,1,1,0,1.9%,1,1,0,3.8%,All James Develin red zone rushing plays,DeveJa00
Gerald Everett,LAR,1,0,0,1.2%,1,0,0,1.9%,0,0,0,.0%,All Gerald Everett red zone rushing plays,EverGe00
Ted Ginn,NOR,1,5,0,1.4%,0,0,0,.0%,0,0,0,.0%,All Ted Ginn red zone rushing plays,GinnTe00
Will Grier,CAR,1,0,0,1.5%,0,0,0,.0%,0,0,0,.0%,All Will Grier red zone rushing plays,GrieWi00
Matt Haack,MIA,1,2,0,1.7%,1,2,0,3.0%,1,2,0,6.7%,All Matt Haack red zone rushing plays,HaacMa00
DeAndre Hopkins,HOU,1,6,0,1.6%,1,6,0,3.3%,0,0,0,.0%,All DeAndre Hopkins red zone rushing plays,HopkDe00
Brian Hoyer,IND,1,6,0,1.4%,1,6,0,2.6%,0,0,0,.0%,All Brian Hoyer red zone rushing plays,HoyeBr00
Andy Isabella,ARI,1,6,0,1.7%,0,0,0,.0%,0,0,0,.0%,All Andy Isabella red zone rushing plays,IsabAn00
Andy Janovich,DEN,1,1,1,1.7%,1,1,1,3.4%,1,1,1,7.1%,All Andy Janovich red zone rushing plays,JanoAn00
Alshon Jeffery,PHI,1,2,1,1.3%,1,2,1,2.5%,1,2,1,4.8%,All Alshon Jeffery red zone rushing plays,JeffAl00
Taiwan Jones,HOU,1,11,0,1.6%,0,0,0,.0%,0,0,0,.0%,All Taiwan Jones red zone rushing plays,JoneTa00
Kyle Juszczyk,SFO,1,-1,0,1.3%,1,-1,0,2.5%,1,-1,0,4.5%,All Kyle Juszczyk red zone rushing plays,JuszKy00
Travis Kelce,KAN,1,4,1,1.5%,1,4,1,2.9%,1,4,1,5.9%,All Travis Kelce red zone rushing plays,KelcTr00
Christian Kirk,ARI,1,6,0,1.7%,0,0,0,.0%,0,0,0,.0%,All Christian Kirk red zone rushing plays,KirkCh01
Zach Line,NOR,1,0,0,1.4%,1,0,0,2.8%,1,0,0,7.7%,All Zach Line red zone rushing plays,LineZa01
T.J. Logan,TAM,1,2,0,1.8%,1,2,0,2.8%,1,2,0,5.0%,All T.J. Logan red zone rushing plays,LogaT.00
Eli Manning,NYG,1,0,0,2.1%,1,0,0,3.3%,0,0,0,.0%,All Eli Manning red zone rushing plays,MannEl00
Sean Mannion,MIN,1,0,0,1.1%,0,0,0,.0%,0,0,0,.0%,All Sean Mannion red zone rushing plays,MannSe00
A.J. McCarron,HOU,1,1,1,1.6%,1,1,1,3.3%,1,1,1,5.3%,All A.J. McCarron red zone rushing plays,McCaA.00
Ty Montgomery,NYJ,1,0,0,3.1%,0,0,0,.0%,0,0,0,.0%,All Ty Montgomery red zone rushing plays,MontTy01
Chris Moore,BAL,1,0,0,1.0%,1,0,0,1.8%,1,0,0,3.6%,All Chris Moore red zone rushing plays,MoorCh00
Matt Moore,KAN,1,-1,0,1.5%,0,0,0,.0%,0,0,0,.0%,All Matt Moore red zone rushing plays,MoorMa01
Quenton Nelson,IND,1,0,0,1.4%,1,0,0,2.6%,1,0,0,5.3%,All Quenton Nelson red zone rushing plays,NelsQu00
Senorise Perry,BUF,1,-1,0,1.5%,0,0,0,.0%,0,0,0,.0%,All Senorise Perry red zone rushing plays,PerrSe00
Philip Rivers,LAC,1,1,0,1.7%,1,1,0,2.8%,0,0,0,.0%,All Philip Rivers red zone rushing plays,RivePh00
Andre Roberts,BUF,1,7,0,1.5%,0,0,0,.0%,0,0,0,.0%,All Andre Roberts red zone rushing plays,RobeAn00
Ben Roethlisberger,PIT,1,7,0,1.7%,0,0,0,.0%,0,0,0,.0%,All Ben Roethlisberger red zone rushing plays,RoetBe00
Sterling Shepard,NYG,1,-2,0,2.1%,1,-2,0,3.3%,0,0,0,.0%,All Sterling Shepard red zone rushing plays,ShepSt00
Anthony Sherman,KAN,1,5,0,1.5%,0,0,0,.0%,0,0,0,.0%,All Anthony Sherman red zone rushing plays,SherAn00
Steven Sims,WAS,1,4,0,2.3%,0,0,0,.0%,0,0,0,.0%,All Steven Sims red zone rushing plays,SimsSt00
Jonnu Smith,TEN,1,4,0,1.8%,0,0,0,.0%,0,0,0,.0%,All Jonnu Smith red zone rushing plays,SmitJo01
Vyncint Smith,NYJ,1,19,1,3.1%,0,0,0,.0%,0,0,0,.0%,All Vyncint Smith red zone rushing plays,SmitVy00
Willie Snead,BAL,1,2,0,1.0%,0,0,0,.0%,0,0,0,.0%,All Willie Snead red zone rushing plays,SneaWi00
Diontae Spencer,DEN,1,5,0,1.7%,0,0,0,.0%,0,0,0,.0%,All Diontae Spencer red zone rushing plays,SpenDi00
Courtland Sutton,DEN,1,1,0,1.7%,1,1,0,3.4%,0,0,0,.0%,All Courtland Sutton red zone rushing plays,SuttCo00
Adam Thielen,MIN,1,1,1,1.1%,1,1,1,1.6%,1,1,1,4.2%,All Adam Thielen red zone rushing plays,ThieAd00
Danny Vitale,GNB,1,3,0,1.8%,0,0,0,.0%,0,0,0,.0%,All Danny Vitale red zone rushing plays,VitaDa00
Dwayne Washington,NOR,1,5,0,1.4%,0,0,0,.0%,0,0,0,.0%,All Dwayne Washington red zone rushing plays,WashDw00
Zach Zenner,NOR,1,1,0,1.4%,0,0,0,.0%,0,0,0,.0%,All Zach Zenner red zone rushing plays,ZennZa00